date,symbols,summary
2025-06-05,NFLX,"On June 4, 2025, Netflix (NFLX) stock rose 1.78% to close at $1,239.66, with an intraday high of $1,242.56 and a 52-week range of $588.43 to $1,242.56. The performance was supported by data highlighting Netflix as a leader in streaming viewership. Benzinga Edge Stock Rankings indicate the stock has positive short, medium, and long-term price trends."
2025-06-06,NFLX,"Netflix (NFLX) stock has gained 40% year-to-date and nearly doubled over 52 weeks. In Q1, the company reported $10.54 billion in revenue and adjusted EPS of $6.61, beating consensus estimates. NFLX is on track for nine consecutive up weeks, a rare occurrence historically associated with a potential short-term correction. An agnostic trading strategy involving a 1225/1220 bear put spread expiring June 20 is suggested to capitalize on a potential temporary pullback to the $1216-$1217 range."
2025-06-07,NFLX,"Monster Beverage Corp. (MNST) has outperformed all S&P 500 stocks over the last 30 years with a 32.6% annualized return since Aug. 18, 1995. A $10,000 investment in 1995 would be worth $44,496,814 today. Netflix Inc. (NFLX) is listed among the top five S&P 500 performers over the same period. Monster Beverage shares are up 22.25% year-to-date, closing at $63.95 on Friday. Analysts currently hold a consensus 'hold' rating with an average price target of $64.24."
2025-06-09,NFLX,"Netflix (NFLX) has outperformed the market over the last 20 years with an average annual return of 36.29%. A $1,000 investment in Netflix 20 years ago would be worth $502,526.53 today, based on a current stock price of $1242.84. The company currently holds a market capitalization of $528.92 billion."
2025-06-09,NFLX,"Kanye West gifted Kim Kardashian stock in Netflix, Apple, Amazon, Disney, and Adidas in 2017. Netflix shares have surged 198.03% over the past five years. A $1,000 investment in Netflix made in 2017 would be worth $6,583.76 today, representing a 558.38% gain. Kardashian's net worth is currently $1.7 billion."
2025-06-10,NFLX,"Analysis of 135 unusual Netflix (NFLX) options trades shows 33% bullish and 35% bearish sentiment, with 78 puts valued at $7,772,671 and 57 calls valued at $2,763,149. The stock is trading at $1229.79, down 0.94%. Five analysts in the last 30 days set an average price target of $1320.0. Ratings include Citigroup (Neutral, $1250), Canaccord Genuity (Buy, $1380), UBS (Buy, $1450), Baird (Outperform, $1300), and JP Morgan (Neutral, $1220). The next earnings report is in 38 days."
2025-06-11,NFLX,Reported Earlier: 'Netflix Will Invest More Than €1 Billion In Spain Between 2025 And 2028'
2025-06-12,NFLX,"Options activity for Netflix (NFLX) shows a call option sweep with bearish sentiment expiring June 13, 2025. Parties traded 35 contracts at a $1225.00 strike price for a total cost of $40.0K. There were 904 open contracts prior to the trade, with 2,100 contracts bought and sold today."
2025-06-13,NFLX,"Netflix (NFLX) has received 28 analyst ratings over the last three months, with 10 bullish, 15 somewhat bullish, and 3 indifferent ratings. The average 12-month price target is $1199.93, up 6.07% from $1131.29, with a range of $1000.00 to $1514.00. Recent analyst actions include multiple upgrades and price target adjustments from firms like Oppenheimer, UBS, and Citigroup. As of March 31, 2025, Netflix reported 12.51% revenue growth, a 27.42% net margin, 11.85% ROE, 5.47% ROA, and a 0.62 debt-to-equity ratio. The company operates a global streaming service with over 300 million subscribers and introduced ad-supported plans in 2022."
2025-06-13,NFLX,"Oppenheimer Maintains Outperform on Netflix, Raises Price Target to $1425"
2025-06-14,NFLX,"The article discusses the volatility of Quantum Computing Inc (QUBT) stock following comments from Nvidia CEO Jensen Huang. It notes that QUBT stock has experienced a rare streak of eight up weeks in a 10-week period, a pattern historically followed by price declines. The author compares this to Netflix (NFLX), which previously saw a rare nine-week win streak before its stock price fell. The article suggests a bearish approach for QUBT using a 15/14 bear put spread expiring July 3, citing statistical risks rather than company fundamentals."
2025-06-16,NFLX,"On June 13, 2025, records showed Rep. Jonathan Jackson filed a sale of Linde stock valued between $65,002 and $150,000, which occurred on May 7, 2025. Recent notable transactions by Rep. Jackson include a $50,001-$100,000 purchase of Netflix (NFLX) stock."
2025-06-16,NFLX,Reported Earlier: 'Netflix Expands Programmatic Availability With Yahoo DSP'
2025-06-17,NFLX,"The article highlights the importance of management's ability to pivot business models to maintain growth, using Netflix as a primary example. Netflix successfully transitioned from a DVD-by-mail rental service to a dominant streaming and original content provider, mailing its final DVD in 2023. The company is currently valued at over $500 billion with its stock trading at an all-time high. The author emphasizes that identifying such transformative companies is difficult and suggests that investors consider broadly diversified index funds to capture exposure to successful corporate pivots."
2025-06-18,NFLX,"Competitive eater Joey Chestnut is returning to the Nathan's Famous Fourth of July Hot Dog Eating Contest after a one-year ban. Netflix (NFLX) previously aired a live competition between Chestnut and Takeru Kobayashi in September, which Chestnut won with 83 hot dogs. Chestnut remains a heavy betting favorite for the upcoming event."
2025-06-18,NFLX,"Netflix (NFLX) is seeing bullish options activity, with 57 calls totaling $3,231,469 and 36 puts totaling $2,309,578. The stock is trading at $1221.72. Analysts have an average price target of $1336.25, with ratings including Oppenheimer (Outperform, $1425), Citigroup (Neutral, $1250), UBS (Buy, $1450), and JP Morgan (Neutral, $1220)."
2025-06-18,NFLX,"Nielsen data for May shows streaming viewership reached 44.8% market share, surpassing the combined 44.2% share of broadcast and cable TV for the first time. Netflix (NFLX) viewership has grown 27% since May 2021, with its series 'You' being the top program in May. Netflix also streamed two NFL games on Christmas Day 2024."
2025-06-19,NFLX,"Roundhill Investments launched five new 'WeeklyPay' ETFs, including the Roundhill NFLX WeeklyPay ETF (BATS: NFLW), which tracks Netflix. These ETFs aim to deliver weekly distributions and 120% of the underlying stock's weekly return using leverage, rather than using covered call options."
2025-06-19,NFLX,"On June 18, 2025, Rep. Rick Allen filed a purchase of Netflix (NFLX) stock valued between $16,002 and $65,000, executed on May 16, 2025. Netflix shares were trading at $1220.25 at the time of the report."
2025-06-20,NFLX,"Pivotal Research Maintains Buy on Netflix, Raises Price Target to $1600"
2025-06-20,NFLX,"Pivotal Research analyst Jeffrey Wlodarczak maintained a Buy rating on Netflix (NFLX) and increased the price target from $1,350 to $1,600. Netflix shares closed at $1,222.29 on Wednesday."
2025-06-20,NFLX,"Wells Fargo Maintains Overweight on Netflix, Raises Price Target to $1500"
2025-06-20,NFLX,"Netflix (NFLX) is a key driver of the momentum rally in 2025, with a year-to-date return of 38.7%. It holds a 4.88% weight in the iShares MSCI USA Momentum Factor ETF (MTUM), significantly higher than its 1.03% allocation in the S&P 500 ETF (SPY)."
2025-06-21,NFLX,"In today's session, a bearish call option trade for Netflix (NFLX) was observed expiring on July 11, 2025. The trade involved 5 contracts at a $1190.00 strike price, with a total trade price of $29.8K and a premium of $5975.0 per contract."
2025-06-23,NFLX,"Netflix's short interest has decreased by 3.65%, with 7.82 million shares sold short, representing 1.85% of float. It would take 2.67 days to cover these positions. Netflix's short interest is lower than its peer group average of 9.94%."
2025-06-24,NFLX,"Netflix (NFLX) options activity shows 98 unusual trades, with 40% bullish and 41% bearish sentiment. The stock is trading at $1,248.26, up 1.37%. Analysts have an average price target of $1,445.0, with ratings from Oppenheimer ($1,425), Wells Fargo ($1,500), UBS ($1,450), Pivotal Research ($1,600), and Citigroup ($1,250). Earnings are expected in 24 days."
2025-06-24,NFLX,"A former Netflix executive suggests the company is building a Disney-style ecosystem through real-world experiences like 'Squid Game' trials, 'Bridgerton' balls, and the upcoming 'Netflix House' to drive retention and revenue. Co-CEO Ted Sarandos noted Netflix invested $125 billion in the U.S. economy from 2020-2024. Netflix shares were up 1.80% to $1,253.54 on Monday."
2025-06-25,NFLX,"Netflix is launching the third and final season of 'Squid Game' on June 27. The mobile game 'Squid Game: Unleashed' will receive updates and expand to Chromebooks and large-screen Android devices. Additionally, 'Fortnite' is introducing limited-time 'Squid Game' themed content, including locations and character skins."
2025-06-25,NFLX,"The Invesco QQQ ETF has formed a 'Golden Cross,' signaling a potential long-term uptrend. Netflix (NFLX), Meta (META), and Microsoft (MSFT) are the top performers among QQQ's top 10 holdings in 2025, with gains of 44.25%, 18.85%, and 17.09% respectively. Netflix's performance is attributed to its content strategy and ad tiers. The QQQ closed Tuesday at $539.78, nearing its 52-week high of $540.81."
2025-06-26,NFLX,"Netflix (NFLX) stock reached a new all-time high on Wednesday, with a 44% year-to-date gain. The company is expanding into real-world experiences like 'Netflix House' based on franchises like 'Squid Game' and 'Bridgerton'. Analysts have reaffirmed confidence: Pivotal Research (Buy, $1,600 target), Wells Fargo (Overweight, $1,500 target), Oppenheimer (Outperform, $1,425 target), and UBS (Buy, $1,450 target). NFLX closed at $1,275.25 on Wednesday, with a 52-week range of $588.43 to $1,298.00."
2025-06-27,NFLX,"Time Magazine's 2025 '100 Most Influential Companies' list features Netflix (NFLX) in the 'Titans' category. The list includes 44 publicly traded companies or units thereof, highlighting businesses driving innovation and growth. Investors can use this list to identify companies with significant market influence and potential for consumer adoption."
2025-06-28,NFLX,"Netflix (NFLX) options activity shows 155 uncommon trades, with sentiment split 32% bullish and 36% bearish. Total volume includes $2.9 million in puts and $16.2 million in calls. The stock is trading at $1,318.88, up 0.93%. Analysts maintain a consensus target price of $1,445.0, with ratings including: Oppenheimer ($1,425), UBS ($1,450), Citigroup ($1,250), Pivotal Research ($1,600), and Wells Fargo ($1,500). Earnings are expected in 20 days."
2025-06-30,NFLX,"Apple's 'F1' movie earned $55.6 million domestically and $144 million worldwide in its opening weekend. With a budget of $250 million to $300 million, estimates suggest the film could gross $500 million to $600 million, potentially becoming Apple's highest-grossing theatrical release. While Apple has struggled with previous theatrical films, 'F1' may be its first profitable one. The film's success also benefits partners like Warner Bros. Discovery and IMAX. Formula 1's popularity in the U.S. has been bolstered by a Netflix docuseries."
2025-06-30,NFLX,"Netflix celebrated the finale of 'Squid Game' with a parade in Seoul and a fan event featuring cast members and director Hwang Dong-hyuk. The series, which premiered its first season on September 17, 2021, remains Netflix's top-performing show with over 2.2 billion viewing hours and 265 million viewers. The third and final season was released on June 27. Netflix stock continues to trend upward."
2025-07-01,NFLX,"The third and final season of 'Squid Game' has premiered on Netflix. Creator Hwang Dong-hyuk confirmed no season four is planned. The finale featured a cameo by Cate Blanchett, fueling rumors of a potential U.S. version of the show. Netflix has not confirmed spinoffs. Season one remains the most-watched series with over 265 million viewers and 2.2 billion hours watched, while season two set a premiere record with 68 million viewers in its first week."
2025-07-01,NFLX,"NASA and Netflix have partnered to bring NASA+ live programming, including rocket launches and space mission coverage, to the Netflix platform. The initiative aims to reach Netflix's global audience of over 700 million people. NASA+ content will remain available on its existing channels, including its website and YouTube."
2025-07-01,NFLX,"Netflix's 'Squid Game' creator Hwang Dong-hyuk stated that Elon Musk and Donald Trump served as unwitting inspirations for the show's third-season VIP characters. The VIPs, who represent powerful figures no longer hiding behind the scenes, take on a larger role in the final season. Musk has previously inspired characters in other Netflix productions, including 'Don't Look Up' and 'Glass Onion: A Knives Out Mystery'."
2025-07-02,NFLX,"The third and final season of 'Squid Game' recorded 60.1 million views in its first three days, setting a Netflix record for a show's first three days. While it fell short of the second season's premiere week record of 68 million views, the second season benefited from an extra day and the Christmas 2024 holiday. Netflix stock closed at $1,293.60 on Tuesday, up over 45% year-to-date in 2025."
2025-07-02,NFLX,"Canaccord Genuity Maintains Buy on Netflix, Raises Price Target to $1525"
2025-07-03,NFLX,Reported Earlier: 'Netflix Explores Music Shows and Celebrity Interviews in Unscripted TV Push' - WSJ
2025-07-03,NFLX,"Options activity for Netflix (NFLX) showed a bullish put option trade expiring on July 3, 2025. The trade involved 11 contracts at a $1,325.00 strike price, with a total trade price of $53.7K and a contract price of $4,890.0."
2025-07-03,NFLX,"Goldman Sachs Maintains Neutral on Netflix, Raises Price Target to $1140"
2025-07-04,NFLX,"Netflix's stock has risen 43.4% in three months and 99% over the past year, reaching a $552 billion market cap and a 52-week high of $1,341. Q1 revenue grew 12.5% to $10.54 billion with $6.61 EPS. The company projects Q2 revenue of $11.04 billion and full-year guidance of $43.5-$44.5 billion. Analysts hold a consensus price target of $1,153, with some forecasts reaching $1,600. Bank of America analyst Jessica Reif Ehrlich projects a $1 trillion valuation by 2030, supported by 94 million ad-supported plan users."
2025-07-04,NFLX,"Netflix is expanding its content library to include reality competitions, music shows, and celebrity interviews, with potential partnerships discussed with Spotify. Upcoming unscripted content includes 'Building the Band' and a reboot of 'Star Search'. This strategy aims to bolster subscriber growth and ad revenue as major series 'Squid Game' and 'Stranger Things' conclude after 2025. Netflix stock is up 45% year-to-date in 2025, trading at $1,300.92."
2025-07-07,NFLX,"NASA and Netflix announced a partnership to stream NASA+ programming, including live rocket launches, spacewalks, and footage from the International Space Station. The collaboration aims to expand the reach of space exploration content to a broader audience."
2025-07-07,NFLX,"Netflix (NFLX) options activity shows a bearish sentiment among large investors, with 40% of trades bearish compared to 17% bullish. In the last 30 days, 13 puts totaling $619,010 and 22 calls totaling $14,511,354 were observed, with a price window of $710.0 to $1700.0. NFLX is currently trading at $1286.87, down 0.79%. Five analysts in the last month provided an average price target of $1438.0, with ratings ranging from Neutral (Goldman Sachs, $1140) to Buy (Pivotal Research, $1600). The company's next earnings report is scheduled for 10 days from now."
2025-07-08,NFLX,"Netflix is challenging cable dominance in summer shark-themed content by launching the reality competition 'All the Sharks' and the documentary 'Shark Whisperer', alongside acquiring streaming rights for the 'Jaws' film series. This move competes with Warner Bros. Discovery's 'Shark Week' and Disney's 'SharkFest'. Nielsen data shows streaming reached a 44.8% market share in May, surpassing combined broadcast and cable viewership."
2025-07-08,NFLX,"Netflix has outperformed the market over the past five years with an average annual return of 18.64%. An investment of $100 in Netflix five years ago would be worth $253.98 today, based on a current stock price of $1,289.62 and a market capitalization of $548.83 billion."
2025-07-08,NFLX,Seaport Global Downgrades Netflix to Neutral
2025-07-08,NFLX,"Unusual options activity for Netflix (NFLX) was recorded on July 11, 2025, involving a bullish call option trade. Seven contracts were traded at a $1,250.00 strike price, with a total trade price of $30.6K and a premium of $4,385.0 per contract."
2025-07-09,NFLX,"Barclays Maintains Equal-Weight on Netflix, Raises Price Target to $1100"
2025-07-09,NFLX,"BofA Securities analyst Justin Post maintained a Buy rating on Uber Technologies and increased the price target from $97 to $115. The analyst noted that the price boost reflects multiple expansion for FANG stocks, including Netflix Inc. (NFLX)."
2025-07-10,NFLX,"Keybanc Maintains Overweight on Netflix, Raises Price Target to $1390"
2025-07-10,NFLX,"Keybanc analyst Justin Patterson upgraded Roku from Sector Weight to Overweight with a $115 price target. Patterson raised 2025E and 2026E EBITDA to $362 million and $530 million, respectively, and projected 2027E revenue of $6.0 billion. Roku's Q1 streaming hours grew 17% Y/Y to 35.8 billion. The analyst noted Roku's shift toward third-party monetization partnerships with The Trade Desk and Amazon, and projected Q2 revenue of $1.08 billion with an EPS of $(0.14)."
2025-07-10,NFLX,"Keybanc analyst Justin Patterson maintained an Overweight rating on Netflix (NFLX) and increased the price target from $1,070 to $1,390. Netflix shares closed at $1,288.28 on Wednesday."
2025-07-10,NFLX,"Apple is reportedly in talks to acquire U.S. media rights for Formula 1, following the success of its 'F1' movie, which has grossed $301.2 million worldwide. The article notes that Netflix's 'Drive to Survive' docuseries previously helped increase interest in Formula 1 in the U.S."
2025-07-11,NFLX,"Netflix shares fell 2.93% to $1250.59 ahead of its Q2 earnings report on July 17. Analysts expect EPS of $7.06 on $11.04 billion in revenue. KeyBanc raised its price target to $1,390 from $1,070, while other recent adjustments include Barclays ($1100), Canaccord Genuity ($1525), Goldman Sachs ($1140), and Pivotal Research ($1600). Seaport Global downgraded the stock to Neutral."
2025-07-11,NFLX,"Akamai Technologies (AKAM) provides content delivery network (CDN) services critical to companies with streaming arms, including Netflix Inc. (NFLX), Apple Inc., and Alphabet Inc."
2025-07-11,NFLX,"Virginia Representative John McGuire filed a report indicating a purchase of Netflix (NFLX) stock valued between $1,001 and $15,000, with a transaction date of June 16, 2025."
2025-07-11,NFLX,"Needham analyst Laura Martin maintained a Buy rating on Netflix and raised the price target from $1,126 to $1,500. Martin highlighted that Netflix recorded the highest revenue per full-time equivalent (FTE) among nine big-cap companies, reporting $2.78 billion in fiscal 2024. Fiscal 2026 revenue estimates were raised to $49.89 billion, with EPS estimates increased to $31.03."
2025-07-11,NFLX,"Needham Maintains Buy on Netflix, Raises Price Target to $1500"
2025-07-12,NFLX,"JP Morgan Maintains Neutral on Netflix, Raises Price Target to $1230"
2025-07-12,NFLX,"Piper Sandler Maintains Overweight on Netflix, Raises Price Target to $1400"
2025-07-12,NFLX,"Piper Sandler analyst Matt Farrell maintained an Overweight rating on Netflix (NFLX) and raised the price target from $1,150 to $1,400. Netflix shares closed at $1,245.11 on Friday."
2025-07-12,NFLX,"Netflix announced that the second season of its reality competition series 'Squid Game: The Challenge' will premiere on Nov. 4, 2025, featuring a $4.56 million prize. Casting is currently open for a third season. The franchise is also expanding with 'Squid Game: The Experience' in New York, London, and Sydney. Netflix stock is up 40.9% year-to-date in 2025, trading at $1,249.58 as of Friday."
2025-07-14,NFLX,"Meta CEO Mark Zuckerberg is set to testify in an eight-day trial regarding shareholder allegations of privacy violations. Shareholders seek over $8 billion in reimbursement for costs and fines, including a 2019 $5 billion FTC penalty. Other defendants include Sheryl Sandberg, Marc Andreessen, Peter Thiel, and Netflix co-founder Reed Hastings."
2025-07-14,NFLX,"Wedbush Reiterates Outperform on Netflix, Maintains $1400 Price Target"
2025-07-15,NFLX,"Stephen Weiss of Short Hills Capital Partners expressed a bullish outlook for Netflix. Piper Sandler analyst Matt Farrell maintained an Overweight rating and raised the price target to $1,400, while Needham analyst Laura Martin maintained a Buy rating and increased the price target to $1,500."
2025-07-15,NFLX,"Netflix is scheduled to report earnings on Thursday, July 17, alongside Taiwan Semiconductor Manufacturing Co. Ltd."
2025-07-15,NFLX,"CNBC Halftime Report Final Trades: Lockheed Martin, Netflix, Check Point Software Technologies, iShares U.S. Industrials ETF"
2025-07-15,NFLX,"BofA Securities analyst Jessica Reif Ehrlich reaffirmed a Buy rating for Netflix with a $1,490 price target. She predicts Q2 earnings of $7.05 per share, slightly above the $7.03 guidance, citing potential benefits from a weakening dollar. 'Squid Game' season 3 achieved 106.3 million views in its first 10 days."
2025-07-16,NFLX,"Representative Rick Allen purchased between $15,001 and $50,000 of Netflix (NFLX) stock on May 16, 2025, according to a July 15, 2025 filing. This follows the STOCK Act requirements for congressional financial disclosures."
2025-07-16,NFLX,"Netflix is scheduled to report Q2 2025 earnings on July 17, 2025. Analysts estimate EPS of $7.05. In Q1 2025, Netflix reported an EPS of $6.61, beating the $5.72 estimate. As of July 15, Netflix shares were trading at $1,260.27, reflecting a 95.63% increase over the past 52 weeks."
2025-07-16,NFLX,"Options activity for Netflix (NFLX) shows a bearish call trade expiring July 18, 2025, with a $1,255 strike price. The trade involved 10 contracts at a total cost of $45.5K."
2025-07-16,NFLX,"Netflix's live stream of the Katie Taylor vs. Amanda Serrano boxing match drew 6 million viewers, with 4.2 million from the U.S. The company holds exclusive U.S. streaming rights for the 2027 and 2031 Women's World Cups and will stream two NFL games on Christmas Day 2025. Netflix stock is up 42% year-to-date in 2025."
2025-07-16,NFLX,"BMO Capital Reiterates Outperform on Netflix, Raises Price Target to $1425"
2025-07-16,NFLX,"Roblox launched a new licensing platform, including a License Manager and Licenses catalog, to simplify IP access for creators. Netflix is a partner, opening franchise titles like 'Stranger Things' and 'Squid Game' for use by Roblox creators."
2025-07-16,NFLX,"Live On CNBC, Josh Brown Hosts Segment Titled ""Best Stock In The Market: Netflix"""
2025-07-17,NFLX,"Bernstein Maintains Outperform on Netflix, Raises Price Target to $1390"
2025-07-17,NFLX,"Netflix (NFLX) stock fell 0.79% to $1,250.31. The company is preparing for its second-quarter earnings report on Thursday, with a focus on content and growth prospects."
2025-07-17,NFLX,"Analysts expect Netflix (NFLX) to report quarterly earnings of $7.06 per share on $11.04 billion in revenue after the closing bell. Netflix shares rose 0.2% to $1,252.92 in after-hours trading."
2025-07-17,NFLX,"The Dow Jones rose 231 points to 44,254.78, while the S&P 500 and Nasdaq also closed higher. The CNN Fear and Greed index remained in the 'Greed' zone at 73.9. Investors are awaiting earnings results from PepsiCo, GE Aerospace, and Netflix."
2025-07-17,NFLX,"Netflix (NASDAQ: NFLX) is scheduled to report quarterly earnings after the bell on July 17, 2025, with estimates of $7.06 per share on revenue of $11.05 billion."
2025-07-17,NFLX,"MoffettNathanson analyst Robert Fishman expects Netflix to report strong Q2 earnings on Thursday, driven by price hikes and ad monetization. He projects 30% earnings growth for the year. Netflix shares are up 41% year-to-date with a $532 billion market cap. The company aims to reach a $1 trillion market cap by 2030, triple its operating income, and grow its subscriber base to 410 million."
2025-07-17,NFLX,Netflix Inc. (NASDAQ: NFLX) shares were up 0.36% in premarket trading on Thursday. Analysts expect the company to report earnings of $7.06 per share on revenue of $11.04 billion after the closing bell.
2025-07-17,NFLX,"Netflix Inc. (NASDAQ: NFLX) is scheduled to report earnings on Thursday, July 17, after market close, kicking off the big tech earnings season."
2025-07-17,NFLX,"Bernstein analyst Laurent Yoon maintained an Outperform rating on Netflix, Inc. (NASDAQ: NFLX) and increased the price target from $1,200 to $1,390. Netflix shares closed at $1,250.31 on Wednesday."
2025-07-17,NFLX,"Meta shareholders are suing executives, including Netflix co-founder Reed Hastings, for $8 billion over alleged failures to protect user data following the Cambridge Analytica scandal. The defendants deny wrongdoing."
