date,symbols,summary
2025-11-01,NFLX,"Netflix shares rose 2.91% to $1,120.52 following the announcement of a 10-for-1 forward stock split. Record date is November 10, 2025, with distribution after the close on November 14, 2025, and split-adjusted trading starting November 17, 2025. The stock is trading near its 200-day moving average of $1,120.42, with a 52-week range of $747.77 to $1,341.15. Year-to-date, the stock is up 26.2%."
2025-11-01,NFLX,"Netflix shares climbed 3.5% on Friday, marking its best session since April, following the announcement of a 10-for-1 stock split effective November 17. The broader tech sector rebounded as major indices showed gains for October."
2025-11-04,NFLX,'Netflix Is in Talks to License Video Podcasts From iHeartMedia'- Bloomberg
2025-11-04,NFLX,Australia To Mandate Streaming Services Invest 10% Of Spend Or 7.5% Of Revenue In Local Content
2025-11-06,NFLX,'Netflix Approaches SiriusXM For Video Podcast Licensing; THis Follows Outreach To Iheartmedia And Talent Agents As The Streamer Makes A Big Push For Podcasts' - The Hollywood Reporter
2025-11-06,NFLX,"'Netflix Switches To New Ad Tier Metric, Claiming 190 Million Monthly Active Viewers' - Deadline"
2025-11-06,NFLX,"Netflix Says This Month, Testing New Modular Ad Formats With Interactive Video Ads In U.S. & Canada; Will Roll New Modular Ad Formats Out Globally By Q2 2026; This Month We're Expanding Our Advanced Demographic Targeting To Reach Relevant Audiences With Precision; In 2026, We Will Scale Our DAI Offering Across More Live Titles"
2025-11-07,NFLX,Comcast Retains Bankers To Evaluate Possible Bid For Warner Bros Discovery Studio
2025-11-11,NFLX,"A SIFMA report indicates that as of October 31, 2025, the top 20 stocks in the S&P 500 account for 50.8% of the index's total market value, up from 45.9% a year ago. These 20 companies generated only 9.1% of the index's total earnings. Netflix is included in the top 20 list with a market cap of $474.1 billion, an index weight of 0.8%, and a forward P/E ratio of 46.6."
2025-11-11,NFLX,"Paramount Skydance CEO David Ellison stated there are 'no must-haves' regarding mergers, prioritizing internal building. Netflix Co-CEO Ted Sarandos similarly dismissed acquisition speculation during the company's Q3 earnings call, noting Netflix has 'plenty of runway for growth' and remains focused on building rather than buying, while remaining open to selective M&A."
2025-11-13,NFLX,"Netflix has outperformed the market over the past 5 years with an average annual return of 18.82%. An investment of $100 in Netflix stock 5 years ago would be worth $237.64 today, based on a share price of $1138.41. The company currently has a market capitalization of $482.38 billion."
2025-11-13,NFLX,"Netflix opened its first 'Netflix House' in King of Prussia, Pennsylvania, featuring immersive sets from shows like 'Stranger Things' and 'Wednesday.' The company plans to open a Dallas location on Dec. 11 and a Las Vegas site in 2027. Netflix reported record TV view share in the U.S. and UK in its latest quarter. Shares were up 1.70% to $1155.73 on Wednesday."
2025-11-14,NFLX,"Netflix Co-CEO Ted Sarandos stated during the company's third-quarter call in October that the streamer is focused on building rather than buying, aligning with a broader trend of major Hollywood players tempering expectations for large-scale mergers and acquisitions."
2025-11-14,NFLX,"Warner Bros Discovery shares rose 3.34% amid reports that Comcast, Netflix, and Paramount are preparing acquisition bids for the company."
2025-11-14,NFLX,"WSJ: Paramount, Comcast, Netflix Among Potential Bidders That Have Looked at Warner Bros. Financials"
2025-11-14,NFLX,"Disney reported 131.6 million Disney+ Core paid subscribers for Q4, an increase of 12.4 million. Operating income for the streaming segment rose 39% to $1.3 billion for the full year. Disney will stop reporting subscriber figures, following the Netflix model. The company raised Disney+ prices in October, with the ad-supported plan at $11.99 and ad-free at $17.99. Disney shares fell 7.9% to $107.43 on Thursday."
2025-11-15,NFLX,"Warner Bros. Discovery shares rose 3.79% to $22.98 following a strategic review. Paramount Skydance, Comcast, and Netflix are reportedly preparing bids, with a nonbinding first-round deadline of November 20. The company plans to split into two businesses: one for studios/streaming and one for cable networks. Recent analyst actions include Wells Fargo raising its target to $25.00, Rothschild & Co upgrading to Buy with a $28.00 target, and Argus Research upgrading to Buy with a $27.00 target."
2025-11-15,NFLX,"Congressman Cleo Fields disclosed trades between October 23 and October 31, including new purchases of Netflix Inc. (valued between $100,000 and $250,000). Other purchases included NVIDIA, Alphabet, Apple, Celestica, and Taiwan Semiconductor. Fields notably excluded Amazon, Microsoft, and Meta from his recent Magnificent Seven trades."
2025-11-15,NFLX,"On Friday, Netflix Inc. (NASDAQ: NFLX) was among the S&P 500's top five losers, with its stock price declining 3.01%."
2025-11-15,NFLX,"Paramount Skydance, Comcast, and Netflix are preparing nonbinding first-round bids for Warner Bros. Discovery, due November 20. Comcast and Netflix are interested in the movie/TV studios and HBO Max, excluding cable assets. Warner Bros. Discovery aims to complete the auction by year-end. Separately, Stingray Group is acquiring TuneIn for $175 million."
2025-11-18,NFLX,"Netflix implemented a 10-for-1 stock split on November 17, reducing its share price from approximately $1,140 to $110. The split did not change the company's $467 billion market cap or its weight in ETFs. Netflix reported Q3 2025 revenue of $11.51 billion, up 17% year-on-year, and is expanding with AI-powered ad formats and 'Netflix House' experiential spaces."
2025-11-18,NFLX,"Netflix's 10-for-1 stock split went into effect on Monday, resulting in a share price of approximately $111, intended to increase accessibility for retail investors."
2025-11-18,NFLX,"Netflix began trading on a split-adjusted basis on Monday following a 10-for-1 forward stock split announced in October. Shareholders of record as of November 10 received nine additional shares for every share held. The company reported Q3 revenue of $11.51 billion and provided Q4 revenue guidance of $11.96 billion, exceeding analyst estimates of $11.90 billion. The stock is currently trading near $111.28, with a support level at $107.33 and resistance at $113.48."
2025-11-18,NFLX,"Viking Global Investors' Q3 13F filing shows a major portfolio reboot, including the complete exit of Nvidia, Amazon, and Qualcomm. The fund initiated new positions in several companies, including Netflix, Microsoft, Aon, Chewy, Edwards Lifesciences, Intuit, KKR, Deckers Outdoor, and Deutsche Bank."
2025-11-19,NFLX,"Netflix shares rose 3.51% to $114.11 despite a price target cut by JPMorgan analyst Doug Anmuth from $127.50 to $124. Anmuth maintained a Neutral rating, citing concerns over media dealmaking and competition, but noted the ad business has reached critical scale with 190 million monthly active viewers. Ad revenue is projected to more than double in 2025 and reach $4.3 billion in 2026."
2025-11-19,NFLX,"CNBC Halftime Report Final Trades: Netflix, NVIDIA, Freeport-McMoRan, Lockheed Martin"
2025-11-19,NFLX,"JPMorgan analyst Doug Anmuth maintained a Neutral rating on Netflix while lowering the price target to $124.00 from $127.50, citing investor concerns over M&A and competition. Netflix has 190 million monthly active ad viewers, and ad revenue is expected to exceed $4.3 billion by 2026. The analyst forecasts 2026 revenue of $50 billion and free cash flow of $12.3 billion, with Q4 revenue projected at $11.96 billion and adjusted EPS of $0.54."
2025-11-19,NFLX,"'Warner Bros. Discovery Bids Are Due This Week. How Do Paramount, Netflix, Comcast Stack Up?'- Variety"
2025-11-19,NFLX,"On CNBC's 'Halftime Report Final Trades,' Joshua Brown expressed a positive outlook on Netflix's price action. Netflix shares gained 3.5% to close at $114.09 on Tuesday, following its recent 10-for-1 forward stock split announced at the end of October."
2025-11-20,NFLX,'Netflix's Warner Bros. Bid Would Include Theater Releases' - Bloomberg
2025-11-20,NFLX,"Representative Cleo Fields of Louisiana filed reports in November 2025 disclosing a purchase of Netflix stock valued between $216,004 and $565,000, dated November 3, 2025. Additionally, a separate filing shows a purchase of Netflix stock valued between $100,001 and $250,000 dated October 31, 2025."
2025-11-20,NFLX,"Netflix is identified as an unexpected suitor for Warner Bros. Discovery, alongside Paramount Skydance and Comcast. While Netflix has never executed a transaction of this scale, it is considered well-positioned due to $17 billion in borrowings and a 24% stock increase in 2025. Warner Bros. Discovery's board is expected to make a final decision by Christmas."
2025-11-20,NFLX,"'Major League Baseball Reaches New Deals With NBC, ESPN, Netflix'- Bloomberg"
2025-11-21,NFLX,"Congressman Cleo Fields (D-La.) made three large purchases of Netflix stock in less than a month, totaling between $300,000 and $750,000. These include disclosures of $100,000 to $250,000 on Oct. 31, Nov. 3, and another purchase on Nov. 3."
2025-11-21,NFLX,"Netflix is expanding its live sports strategy with a new MLB deal, airing three events in 2026 including the opening night game, the Home Run Derby, and the Field of Dreams game, with additional events through 2028. The company also continues its NFL Christmas Day programming, having previously set streaming records with 24.3 million and 24.1 million viewers for its 2024 games. Future rights include the World Baseball Classic in 2027 and the Women's World Cup in 2031."
2025-11-22,NFLX,Jim Cramer stated on CNBC's 'Mad Money Lightning Round' that he prefers Netflix over FuboTV. Netflix shares declined 3.9% to settle at $105.67 on Thursday.
2025-11-22,NFLX,"Netflix is one of three bidders for Warner Bros. Discovery, specifically interested in acquiring its assets for streaming, such as 'Superman' and 'Harry Potter' properties."
2025-11-22,NFLX,"Netflix shares have fallen approximately 11% since its third-quarter earnings. Analysts have raised concerns regarding the company's M&A strategy, intensifying competition, and uncertainty surrounding the scaling of its advertising business and next growth phase."
2025-11-24,NFLX,"JP Morgan analyst Doug Anmuth maintained a Neutral rating on Netflix and lowered the price target from $127.5 to $124 on Nov. 18. The analyst projects an 18% gain in the stock. On Oct. 30, Netflix announced a 10-for-1 forward stock split."
2025-11-25,NFLX,"Spotify is planning a U.S. price hike for the first quarter of 2026, its first since July 2024. Record labels are pressuring streaming platforms to raise prices, arguing that subscription costs have not kept pace with inflation and remain lower than video services like Netflix. In Q3 2025, Spotify reported $4.99 billion in revenue and 713 million monthly active users, though premium average revenue per user declined 4% year-over-year."
2025-11-25,NFLX,"Netflix Inc's (NFLX) short interest has increased by 11.11% since the last report, with 6.74 million shares sold short, representing 1.6% of the float. It would take approximately 1.22 days to cover these positions. Despite the rise, Netflix's short interest remains below the peer group average of 7.60%."
2025-11-26,NFLX,"Netflix has over 300 million subscribers globally, with NFLX stock gaining 24% over the past 52 weeks. The company's ad tier is a significant profit lever, though recent earnings missed expectations at $5.87 per share versus a $6.94 consensus. Direxion offers leveraged ETFs NFXL (2x bull) and NFXS (1x bear) for speculating on NFLX, though these are designed for daily holding periods and carry volatility risks."
2025-11-26,NFLX,"Netflix is prioritizing Taiwan for global growth by expanding partnerships with the Golden Horse Film Festival and launching talent initiatives. In Q3, Netflix reported $11.51 billion in revenue, up 17.2% year-over-year, with earnings of $5.87 per share. The company forecasts Q4 revenue of $11.96 billion and full-year revenue of $45.1 billion. Key upcoming content includes 'Stranger Things' and two NFL Christmas games."
2025-11-26,NFLX,"Netflix is leveraging the 99th annual Macy's Thanksgiving Day Parade to promote its content, featuring a 'Stranger Things' float and a 'KPop Demon Hunters' float. The company will release the first part of the final season of 'Stranger Things' on November 26, 2025. Netflix also plans to utilize NFL games and the final season of 'Stranger Things' for further engagement on Christmas Day. The parade will air on NBC and stream on Peacock."
2025-11-26,NFLX,"Paramount Skydance and Warner Bros. Discovery are partnering to produce 'Rush Hour 4', the first sequel in the franchise since 2007, starring Chris Tucker and Jackie Chan. Paramount Skydance will receive a double-digit percentage distribution fee. Reports suggest Donald Trump encouraged the project and favors a Paramount Skydance acquisition of Warner Bros. Discovery over other bidders, including Netflix and Comcast, citing potential regulatory hurdles for the latter."
2025-11-26,NFLX,"LCM Capital Management advises investors to look beyond superficial diversification in mutual funds, noting that many funds hold concentrated positions in the same major tech stocks, including Netflix (NFLX), Nvidia, Microsoft, Meta, Apple, Alphabet, Broadcom, Amazon, and Eli Lilly. The firm argues that owning these stocks across multiple funds does not constitute true diversification and recommends direct ownership to better protect portfolios during market corrections."
2025-11-27,NFLX,"The Detroit Lions and Dallas Cowboys maintain a long-standing NFL tradition of playing on Thanksgiving Day, a practice dating back to 1934 for the Lions and 1966 for the Cowboys. Netflix is noted as a media partner for upcoming Christmas Day games. NFL viewership is up 6% year-over-year through Week 11, with 2025 Thanksgiving games featuring the Packers at Lions, Chiefs at Cowboys, and Bengals at Ravens."
2025-12-02,NFLX,"Analysis of 65 unusual Netflix options trades revealed 56% bullish sentiment, with 47 calls valued at $2,482,275 and 18 puts valued at $1,459,767. NFLX is trading at $108.83. Four analysts recently provided ratings with an average price target of $434.0, including an Outperform rating from KGI Securities ($1350 target), Buy from Rosenblatt ($152), Neutral from JP Morgan ($124), and Equal-Weight from Barclays ($110)."
2025-12-02,NFLX,"Warner Bros. Discovery shares rose 0.75% to $24.05 following reports that Netflix submitted a mostly cash offer for a partial or complete takeover. Netflix and Comcast are reportedly interested in acquiring Warner Bros. studios and HBO Max, while Paramount has bid for a total takeover. The auction process could conclude this week, with Netflix reportedly working on a bridge loan in the tens of billions of dollars."
2025-12-02,NFLX,'Warner Bros. Gets Mostly Cash Netflix Offer in New Round of Bids' - Bloomberg News
2025-12-02,NFLX,"In today's session, a bullish call option trade for Netflix (NFLX) was recorded with an expiration date of January 15, 2027. The trade involved 24 contracts at a $111.00 strike price, with a total trade price of $42.2K and a per-contract price of $1760.0. Prior to this, there were 908 open contracts at this strike, and 865 contracts were traded today."
2025-12-03,NFLX,"CNBC Halftime Report Final Trades: Netflix, Oracle, Teradyne, iShares U.S. Financial ETF"
2025-12-03,NFLX,'Netflix Warner Bros Discovery Combo Seen Lowering Costs For Consumers Sources Say' - Reuters Exclusive
2025-12-03,NFLX,"Joshua Brown of Ritholtz Wealth Management named Netflix as his final trade on CNBC's 'Halftime Report Final Trades.' The company previously announced a 10-for-1 forward stock split on October 30. Netflix shares closed at $109.35 on Tuesday, gaining 0.2%."
2025-12-03,NFLX,"Netflix's 'Stranger Things' season 5, released November 26, set a record for the biggest premiere week for an English-language show with 59.6 million views and 284.2 million hours viewed. Analysts expect Q4 2026 revenue of $11.96 billion. The stock closed at $109.35 on Tuesday, up 23.2% year-to-date, with a 52-week range of $82.11 to $134.12."
2025-12-04,NFLX,"Netflix shares fell 5.20% to $103.66 on Wednesday following reports of a potential cash bid for Warner Bros. Discovery's studios and streaming division to create a bundle. The stock is trading 9.6% below its 50-day moving average and 8.9% below its 200-day moving average. Trading volume reached 31.1 million shares, with support identified at $102.03 and $100."
2025-12-04,NFLX,Netflix shares dropped 6% to an eight-month low on Wednesday amid reports of U.S. regulatory scrutiny regarding a potential takeover of Warner Bros. Discovery and a stock sale by a company director.
2025-12-04,NFLX,"Bad Bunny is the top global artist on Spotify for 2025 with 19.8 billion streams, surpassing Taylor Swift. He is scheduled to perform at the Super Bowl LX Halftime Show on Feb. 8, 2026. Netflix is highlighted as a winner on the 2025 Spotify list, with the soundtrack from its animated film 'KPop Demon Hunters' ranking second globally for albums and fourth in the U.S., while the single 'Golden' ranked seventh globally and sixth in the U.S."
2025-12-04,NFLX,CNBC Reports Netflix Leading Bidder For Warner Bros Discovery; Bid Believed To Be 85% Cash
2025-12-04,NFLX,"Netflix shares fell 4.93% to close at $103.96 on December 3, 2025, with a 52-week range of $134.12 to $82.11. The company reportedly explored acquiring Warner Bros. Discovery's studios and streaming operations to create a consumer cost-cutting bundle. The potential deal faces political pushback and regulatory concerns regarding market power."
2025-12-05,NFLX,'Paramount Raises Concerns About Netflix's Bid for Warner Bros. Discovery' - The Wall Street Journal Exclusive
2025-12-05,NFLX,'Paramount Raises Concerns About Netflix's Bid for Warner Bros. Discovery' - WSJ Exclusive
2025-12-05,NFLX,"Netflix stock is trading at $103.05, down 17.49% over the past six months, and is nearing a 'Death Cross' as the 50-day moving average ($113.57) approaches the 200-day moving average ($113.43). The stock has been below its 200-day moving average for ten consecutive sessions. Market sentiment is pressured by concerns over slowing subscriber growth and increased competition."
2025-12-05,NFLX,"Options activity for Netflix (NFLX) showed a bullish put trade expiring on December 18, 2026, with a $90.00 strike price. The trade involved 750 contracts at a total cost of $615.7K, with a price of $821.0 per contract."
2025-12-05,NFLX,"Netflix's animated movie 'KPop Demon Hunters' was the second most-searched term on Google in 2025 and is the most-watched movie on the platform to date. Netflix has signed consumer product deals with Mattel and Hasbro for the film. Apple's iPhone 17 release in September drove record-setting performance, positioning the company to potentially overtake Samsung as the global smartphone leader."
2025-12-05,NFLX,"Netflix Inc. announced an $82.7 billion deal to acquire Warner Bros. Discovery. Following the announcement, Netflix shares fell 4.38% in premarket trading on Friday. Investors are currently awaiting the September PCE price index reading, while markets price in an 87% chance of a Federal Reserve rate cut in December."
2025-12-05,NFLX,"In 2025, Netflix and Apple showed strength in Google search trends. Netflix's 'KPop Demon Hunters' was the top-trending movie, and 'The Hunting Wives' was the top-trending TV show. Netflix placed three titles in the top 10 for both movies and TV shows. Apple's 'F1' became its top-grossing film, and 'Severance' ranked sixth for TV shows. Apple has raised prices and is adding sports content to boost profitability."
2025-12-05,NFLX,"Netflix announced an $82.7 billion deal to acquire Warner Bros Discovery, valuing WBD at $27.75 per share. The deal is expected to close after WBD separates its cable networks unit, anticipated in Q3 2026. Netflix expects $2-3 billion in annual cost savings by year three and accretion to GAAP EPS by year two."
2025-12-05,NFLX,"Netflix has entered exclusive negotiations to acquire Warner Bros. Discovery's studio and streaming assets, including HBO Max and intellectual property like 'Harry Potter' and the DC Universe. Reports on the bid price vary between $28 and $30 per share, with a proposed $5 billion break-up fee. The deal faces potential antitrust scrutiny and opposition from the Department of Justice. Netflix shares dropped 0.71% to $103.22 on Thursday amid the news."
2025-12-05,NFLX,'Warner Bros. Begins Exclusive Deal Talks With Netflix' - Bloomberg
2025-12-05,NFLX,"Netflix To Acquire Warner Bros In A Deal For $72B, $27.75/Share In Cash, Stock"
2025-12-05,NFLX,"Netflix shares fell 0.56% to $103.37 on Thursday amid reports that it is the primary bidder for Warner Bros. Discovery's assets, including HBO Max and various cable networks. Investors are concerned about the financial consequences of the deal, as reports suggest it may not significantly increase Netflix's subscriber base. Warner Bros. Discovery previously rejected three bids from Paramount."
2025-12-05,NFLX,"Netflix entered a definitive agreement to acquire Warner Bros. Discovery in a cash-and-stock deal valued at $82.7 billion in enterprise value, or approximately $72 billion in equity. Shareholders will receive $23.25 in cash and $4.501 in Netflix stock per share. The deal is expected to close after the separation of Warner Bros. Discovery's Global Networks business, projected for Q3 2026. Netflix anticipates $2 billion to $3 billion in annual cost savings by year three and expects the deal to be accretive to GAAP earnings per share by year two. Paramount Skydance has challenged the auction process, alleging bias."
2025-12-06,NFLX,"Netflix's proposed $82.7 billion acquisition of Warner Bros. Discovery has faced significant backlash from politicians, including Sen. Elizabeth Warren, and industry figures who fear it will create a media monopoly, raise prices, and reduce consumer choice. Critics, including former Labor Secretary Robert Reich and Rep. Ro Khanna, warn of job losses and negative impacts on theaters and creators. SAG-AFTRA is reviewing the deal, while Paramount Skydance has accused Warner Bros. of a biased auction process. On Friday, Netflix closed at $100.24, down 2.89%, while Warner Bros. Discovery closed at $26.08, up 6.28%."
2025-12-06,NFLX,"Melissa Otto of S&P Global Visible Alpha suggests Netflix's $82.7 billion acquisition of Warner Bros. Discovery is a strategic move to build a 'moat' against Google's AI ambitions. Otto argues that owning a large 'video corpus' is essential for training generative AI models, particularly as Google's TPU chips threaten Netflix's market position. Nielsen data from October shows Netflix holds 8% of TV viewing time, trailing YouTube's 12.9%."
2025-12-06,NFLX,"Netflix shares dipped over 5% early in the week after chairman Reed Hastings sold approximately 375,000-377,000 shares for $40.7 million. Despite this, the company saw record premiere viewership for the final season of 'Stranger Things' and entered exclusive talks to acquire Warner Bros. Discovery. The stock traded between $103 and $105, with a 52-week range of $82.11 to $134.12."
2025-12-06,NFLX,"Netflix's $82.7 billion acquisition of Warner Bros. Discovery faces regulatory hurdles, opposition from the Trump administration, movie theaters, and Hollywood talent. The deal, which values Warner Bros. at $27.75 per share, requires Warner Bros. to separate its cable networks by Q3 2026. The Trump administration has expressed a preference for Paramount Skydance, raising concerns about potential regulatory blocks. Additionally, theater owners group Cinema United and anonymous Hollywood figures have criticized the deal, citing concerns over the future of theatrical releases and industry job losses, despite Netflix co-CEO Ted Sarandos stating the company is not opposed to theatrical releases."
2025-12-06,NFLX,"Netflix's $82 billion acquisition of Warner Bros. Discovery's studio and streaming assets, including HBO and HBO Max, could significantly impact the Communication Services Select Sector SPDR (XLC) ETF. Analysts suggest that if the deal closes in 2026, Netflix could become a top-tier holding, potentially leading to a highly concentrated portfolio dominated by a few mega-cap companies. This concentration raises concerns about the ETF's ability to provide diversified exposure and the potential for automated inflows to distort Netflix's stock pricing."
2025-12-06,NFLX,"Live On CNBC, Josh Brown Announces Cut Netflix Position By 85%"
2025-12-06,NFLX,"Netflix Inc. (NASDAQ: NFLX) shares dropped 3.5% following the announcement of a definitive agreement to acquire Warner Bros. Discovery Inc. (NASDAQ: WBD). The transaction values Warner Bros. Discovery at $27.75 per share, representing an equity value of approximately $72 billion. The deal includes Warner Bros.' film and television studios, as well as HBO and HBO Max. Paramount Skydance Corp. (NASDAQ: PSKY) shares fell 7% after alleging the auction process was biased in favor of Netflix."
2025-12-06,NFLX,"'Netflix Co-CEO Ted Sarandos Told Investors On Friday That He Was ""highly Confident In The Regulatory Process"" And Will Win Approval Of The Streaming Giant's Proposed Purchase Of Warner Bros., But There Are Plenty Of Hurdles Ahead' - Deadline"
