date,symbols,summary
2025-01-02,NFLX,"Netflix has outperformed the market over the last 20 years with an average annual return of 37.14%. A $1,000 investment in Netflix 20 years ago would be worth $561,082.73 today, based on a current stock price of $892.00. The company currently holds a market capitalization of $381.29 billion."
2025-01-02,NFLX,"In 2024, the Communication Services Select Sector SPDR Fund (XLC) gained 33.24%, outperforming the S&P 500's 23.31% return. This surge was driven by entertainment companies, including Netflix, which rose over 83.07% due to growth in its ad-supported tiers, alongside Meta Platforms and Fox Corp."
2025-01-02,NFLX,"Netflix's 'Squid Game' Season 3 is scheduled to premiere in the summer or autumn of 2025. Season 2, released on Dec. 26, 2024, achieved 68 million views in its premiere week. Netflix stock rose 90.25% in 2024, with analysts from UBS, Oppenheimer, and Loop Capital setting an average price target of $1,018.33."
2025-01-03,NFLX,"Benchmark Maintains Sell on Netflix, Raises Price Target to $720"
2025-01-03,NFLX,"Benchmark analyst Matthew Harrigan maintained a Sell rating on Netflix, Inc. (NASDAQ: NFLX) while raising the price target from $555 to $720. Netflix shares settled at $886.73 on Thursday."
2025-01-03,NFLX,"Netflix historically performs well in January, with positive returns in 15 of the last 20 years and an average return of 12.64%. The stock's performance is often driven by its fourth-quarter earnings release, typically announced in the second half of January. Netflix is scheduled to report its fourth-quarter 2024 earnings on Jan. 21, 2025."
2025-01-04,NFLX,"Netflix's 'Squid Game' Season 2 drew over 100 million global viewers within days of its debut, setting new records. This news comes as the broader U.S. stock market experienced five consecutive losing sessions to start the year, amid rising Treasury yields and uncertainty ahead of the next presidential term."
2025-01-04,NFLX,"Live On CNBC, Steve Weiss Trimmed Netflix Position"
2025-01-04,NFLX,"Benchmark analyst Matthew Harrigan maintained a Sell rating on Netflix but raised the price target from $555 to $720, citing strong execution and global scaling. Harrigan projects Q4 revenue of $9.83 billion and EPS of $3.88. The analyst's model assumes Netflix reaches 490 million members by 2033 with a 37% operating profit margin."
2025-01-04,NFLX,"Netflix Inc. (NASDAQ: NFLX) achieved a company record of 68 million views for 'Squid Game' Season 2 in its first week. Additionally, NFL Christmas Day games helped drive subscriber engagement."
2025-01-04,NFLX,"The Sixth Circuit Court of Appeals ruled on Jan. 2 that the FCC lacks the authority to classify broadband as a 'telecommunications service,' effectively overturning net neutrality rules. This decision allows ISPs like Comcast, Verizon, and AT&T to manage networks without previous regulatory constraints, potentially impacting content providers like Netflix, Alphabet, Amazon, and Meta, who may face 'fast lane' access costs."
2025-01-05,NFLX,"Netflix, Inc.'s (NASDAQ: NFLX) Squid Game is back with its second season, and fans are buzzing about the third and final season."
2025-01-06,NFLX,"Netflix Inc.'s (NASDAQ: NFLX) 'The Crown' has received massive viewership, and the company announced two new projects featuring Prince Harry and Meghan Markle. A December 2024 Evercore survey indicated Netflix has extended its lead in content quality compared to Disney+ and Amazon Prime Video."
2025-01-07,NFLX,"Netflix Inc. (NASDAQ: NFLX) is debuting live sports with WWE's Monday Night RAW on January 6 under a deal with TKO Group Holdings, Inc. Previously, Netflix streamed a boxing event with Jake Paul and Mike Tyson (109 million global viewers) and two NFL games on Christmas Day. Oppenheimer analyst Jason Helfstein views Netflix as a mainstream media stock backed by ad potential from these live events. NFLX stock is down 0.85% at $873.59."
2025-01-08,NFLX,"Goldman Sachs Maintains Neutral on Netflix, Raises Price Target to $850"
2025-01-09,NFLX,"Goldman Sachs analyst Eric Sheridan reiterated a Neutral rating on Netflix and raised the price target from $750 to $850. Netflix reports Q4 earnings on Jan. 21, with expectations of $10.13 billion in revenue and $4.20 EPS. Key themes include live sports (Jake Paul vs. Mike Tyson, NFL games, WWE) and advertising, with the ad-supported tier representing 43% of U.S. subscribers. Netflix stock is up 81% over the last year, trading at $878.39."
2025-01-09,NFLX,"Disney reported 157 million global monthly ad-supported users across Disney+, Hulu, and ESPN+, including 112 million in the U.S. In comparison, Netflix reported 70 million monthly users for its ad-supported tier in November 2024, while approximately 80% of Amazon Prime viewers subscribe to its ad-supported tier."
2025-01-10,NFLX,"The Netflix premiere of 'WWE Monday Night Raw' attracted 2.6 million U.S. households, more than doubling the 1.2 million average on the USA Network in 2024. Globally, the episode reached 4.9 million views across Monday and Tuesday. Netflix's $5 billion deal with TKO Group Holdings marks its largest live programming venture."
2025-01-10,NFLX,"Netflix has over 280 million global subscribers. Financial metrics include a P/E ratio of 49.46, P/B of 16.46, P/S of 10.26, and an ROE of 10.54%. The company reported $6.69 billion in EBITDA and $4.7 billion in gross profit, with a revenue growth rate of 15.02%. Its debt-to-equity ratio is 0.7."
2025-01-10,NFLX,"On January 9, 2025, a bullish call option sweep for Netflix (NFLX) was observed. The trade involved 60 contracts at an $875.00 strike price, expiring on January 10, 2025. The total trade price was $45.6K, with a premium of $760.0 per contract. The trade was split into 4 parts, with 774 contracts traded today against 315 existing open contracts."
2025-01-11,NFLX,"JP Morgan Maintains Overweight on Netflix, Lowers Price Target to $1000"
2025-01-11,NFLX,"JP Morgan analyst Doug Anmuth maintained an Overweight rating on Netflix (NFLX) while lowering the price target from $1,010 to $1,000. Netflix shares closed at $875.00 on Wednesday."
2025-01-14,NFLX,"Netflix options data shows a bearish sentiment among large traders, with 5 puts and 4 calls identified. Big players are targeting a price range of $705 to $1000. The stock is up 0.31% at $842.86, with earnings expected in 7 days. Five analysts in the last 30 days set an average price target of $840. Ratings include Benchmark (Sell, $720), Macquarie (Outperform, $965), Goldman Sachs (Neutral, $850), Loop Capital (Hold, $950), and Barclays (Underweight, $715)."
2025-01-14,NFLX,Barclays analyst Kannan Venkateshwar maintained an Underweight rating on Netflix and raised the price target from $550 to $715. Netflix shares closed at $840.29 on Monday.
2025-01-14,NFLX,"Guggenheim Maintains Buy on Netflix, Raises Price Target to $950"
2025-01-14,NFLX,"Barclays Maintains Underweight on Netflix, Raises Price Target to $715"
2025-01-14,NFLX,"Macquarie Maintains Outperform on Netflix, Raises Price Target to $965"
2025-01-14,NFLX,"Netflix and Meghan Markle are delaying the launch of the eight-episode cooking reality series 'With Love, Meghan' from January 15 to March 4, 2025, due to the California wildfires. The show features guests including Roy Choi, Mindy Kaling, and Alice Waters."
2025-01-14,NFLX,"Macquarie analyst Tim Nollen reiterated an Outperform rating on Netflix and raised the price target from $795 to $965. Nollen estimates Netflix will reach 293 million global subscribers by the end of 2024. Key growth drivers include advertising monetization, with projected revenue of $2 billion in 2025, $3 billion in 2026, and $4.5 billion in 2027, alongside live events and potential price increases."
2025-01-15,NFLX,"Piper Sandler Maintains Overweight on Netflix, Raises Price Target to $950"
2025-01-15,NFLX,"BMO Capital analyst Brian Pitz maintained an Outperform rating on Netflix and raised the price target from $825 to $1,000. Netflix shares closed at $828.40 on Tuesday."
2025-01-15,NFLX,"BMO Capital Maintains Outperform on Netflix, Raises Price Target to $1000"
2025-01-16,NFLX,Seaport Global analyst David Joyce upgraded Netflix from Neutral to Buy and announced a $955 price target. Netflix shares closed at $848.26 on Wednesday.
2025-01-16,NFLX,"Amazon's exclusive NFL Playoffs stream averaged 22.07 million viewers, setting a Prime Video record but trailing the 24.1 million and 24.3 million average viewers for Netflix's Christmas Day NFL games. Amazon's 2024 NFL viewership averaged 13.5 million, up 13% year-over-year."
2025-01-16,NFLX,"On CNBC, Steve Weiss Announces Bought More Netflix"
2025-01-16,NFLX,"BMO Capital analyst Brian Pitz maintained an Outperform rating on Netflix and raised the price target from $825 to $1,000. Netflix has 70 million AVOD monthly active users, projected to reach 90 million by the end of 2025. The analyst estimates 4.5 ads per hour, rising to 5 in 2026. Content like Squid Game 2 and WWE are driving engagement."
2025-01-16,NFLX,"Oppenheimer Maintains Outperform on Netflix, Lowers Price Target to $1040"
2025-01-16,NFLX,"Seaport Global Upgrades Netflix to Buy, Announces $955 Price Target"
2025-01-16,NFLX,"Rosenblatt Maintains Neutral on Netflix, Maintains $680 Price Target"
2025-01-17,NFLX,"Sony's PlayStation canceled unannounced live-service projects at Bend Studio and Bluepoint Games following a strategic review. Sony sold 3.8 million PS5 units in Q2 2024. The gaming industry has faced significant challenges, including studio closures such as Netflix's Southern California AAA game studio, Team Blue."
2025-01-17,NFLX,"IMAX Has Entered Into An Agreement With Netflix, Inc. To Debut Oscar-Nominated Director Greta Gerwig's Forthcoming Film ""Narnia"" Exclusively Across The IMAX Global Theater Network With A Two-Week Run Beginning Thanksgiving 2026."
2025-01-17,NFLX,"Seaport Research Partners analyst David Joyce upgraded Netflix from Neutral to Buy with a $955 price target. The firm raised its global paid net additions estimate from 5.73 million to 9.02 million for Q4. Joyce projects Q4 ad revenue could reach $609 million, up 160%."
2025-01-17,NFLX,"Loop Capital Maintains Hold on Netflix, Lowers Price Target to $925"
2025-01-17,NFLX,"Rosenblatt analyst Barton Crockett maintained a Neutral rating on Netflix with a $680 price target. He expects a Q4 subscriber beat driven by sports, but cautions that Q1 guidance may be weak due to potential churn of subscribers who joined for NFL games and the Paul/Tyson fight. Netflix reports Q4 results on Jan. 21."
2025-01-18,NFLX,"JPMorgan analyst David Karnovsky forecasts the 2025 North American box office to reach $9.50 billion, a 10.8% year-over-year increase. Quarterly projections are $1.77B (Q1), $2.44B (Q2), $2.57B (Q3), and $2.73B (Q4). While the streaming market and Netflix's increased film output have shortened theatrical windows, the analyst remains constructive on the theater industry. Goldman Sachs analyst Stephen Laszczyk estimates a $9.4 billion box office for 2026, with Sell ratings on IMAX ($16 target) and Cinemark ($24 target)."
2025-01-18,NFLX,"IMAX Corp and Netflix have agreed to an exclusive two-week theatrical release for Greta Gerwig's 'Narnia' beginning Thanksgiving 2026, followed by a Netflix premiere at Christmas 2026. Netflix added 9 million subscribers in the holiday quarter, driven by sports and 'Squid Game'. BMO Capital's Brian Pitz expects Netflix's AVOD monthly active users to reach 90 million by 2025, up from 70 million in Q4 2024."
2025-01-18,NFLX,"Netflix reports Q4 earnings Tuesday with Wall Street expecting $4.19 EPS and $10.11 billion in revenue. The stock is up 79.33% over the past year and 33.04% over the past six months but faces bearish momentum, trading below its 5, 20, and 50-day EMAs. The consensus analyst rating is a Buy with a $870.13 price target, though recent ratings from Loop Capital, Seaport Global, and Rosenblatt imply a 0.72% downside with an average target of $853.33."
2025-01-20,NFLX,"Netflix's short interest has decreased by 4.68% since the last report, with 6.90 million shares sold short, representing 1.63% of the float. It would take traders 2.58 days to cover these positions. Netflix's short interest is lower than its peer group average of 8.05%."
2025-01-21,NFLX,"U.S. stock futures are trading higher on Tuesday. Key stocks to watch include 3M Co., expected to report earnings of $1.66 per share on $5.78 billion revenue; D.R. Horton Inc., expected to report $2.36 per share on $7.08 billion revenue; and United Airlines, projected to report $2.99 per share on $14.40 billion revenue. Moderna Inc. shares rose 4.5% following news of U.S. HHS support for its pandemic influenza vaccines. Netflix Inc. is expected to report earnings of $4.19 per share on $10.11 billion revenue after the closing bell."
2025-01-21,NFLX,"The CNN Money Fear and Greed index remained in the 'Fear' zone at 37.7 on Friday. U.S. stocks settled higher, with the Dow Jones gaining 335 points to 43,487.83, the S&P 500 rising 1% to 5,996.66, and the Nasdaq Composite climbing 1.51% to 19,630.20. Industrial production rose 0.9% in December, and housing starts increased 15.8% to an annualized rate of 1.499 million units. Investors are awaiting earnings results from 3M Co., D.R. Horton Inc., and Netflix Inc."
2025-01-21,NFLX,"Netflix is scheduled to report its fourth-quarter earnings after the bell on January 21, 2025, with estimates of $4.20 per share in earnings and $10.13 billion in revenue."
2025-01-21,NFLX,"Netflix will report Q4 earnings on Jan. 21, 2025, with expectations of $4.20 EPS and $10.11 billion in revenue. IMAX announced a deal to exclusively screen the film 'Narnia' in theaters for two weeks starting Thanksgiving 2026. Recent analyst ratings include a $925 target from Loop Capital, $955 from Seaport Global, $680 from Rosenblatt, $1,040 from Oppenheimer, and $1,000 from BMO Capital."
2025-01-21,NFLX,"JMP Securities initiated coverage on Roku with an Outperform rating and a $98 price target, citing a shift of advertising dollars from linear TV to connected TV. Netflix, a competitor, is set to report Q4 earnings after the market close on Tuesday, with analysts expecting $4.19 EPS and $10.11 billion in revenue."
2025-01-21,NFLX,"Universal Pictures' 'Wicked' surpassed $700 million at the global box office, becoming the highest-grossing non-sequel of 2024. JPMorgan analyst David Karnovsky remains constructive on the movie theater industry, noting the rise of the streaming market led by Netflix and projecting the 2025 domestic box office to reach $9.50 billion."
2025-01-21,NFLX,U.S. stocks were set to open higher following the inauguration of President Donald Trump. Netflix shares edged up 0.8% in premarket trading ahead of its scheduled earnings report on Tuesday.
2025-01-22,NFLX,"Needham Maintains Buy on Netflix, Raises Price Target to $1150"
2025-01-22,NFLX,"B of A Securities analyst Jessica Reif Ehrlich raised the price target for Netflix (NFLX) from $1,000 to $1,175 and maintained a Buy rating. Netflix shares closed at $869.68 on Tuesday."
2025-01-22,NFLX,"BMO Capital Reiterates Outperform on Netflix, Raises Price Target to $1175"
2025-01-22,NFLX,"Baird Maintains Outperform on Netflix, Raises Price Target to $1200"
2025-01-22,NFLX,"Macquarie Maintains Outperform on Netflix, Raises Price Target to $1150"
2025-01-22,NFLX,"Netflix reported Q4 revenue of $10.25 billion (up 16% YoY) and EPS of $4.27, both beating estimates. Paid subscribers grew by 18.91 million (up 15.9% YoY). 2025 revenue guidance is $43.5 billion to $44.5 billion. Multiple analysts raised price targets: Canaccord Genuity ($940 to $1,150), Barclays ($715 to $900), Needham ($800 to $1,150), Deutsche Bank ($650 to $875), Pivotal Research ($1,100 to $1,250), B of A Securities ($1,000 to $1,175), Morgan Stanley ($1,050 to $1,150), and JP Morgan ($1,000 to $1,150)."
2025-01-22,NFLX,Market-Moving News for January 22nd
2025-01-22,NFLX,"Canaccord Genuity analyst Maria Ripps upgraded Netflix (NFLX) from Hold to Buy and increased the price target from $940 to $1,150. Netflix shares closed at $869.68 on Tuesday."
2025-01-22,NFLX,"JP Morgan Maintains Overweight on Netflix, Raises Price Target to $1150"
2025-01-22,NFLX,"Morgan Stanley Maintains Overweight on Netflix, Raises Price Target to $1150"
2025-01-22,NFLX,"Netflix shares rose 15% in premarket trading after announcing a 16% price hike for its standard plan (from $15.49 to $17.99). Premium and ad-supported tiers also saw price increases. Q4 revenue reached $10.25 billion with 18.91 million new subscribers, totaling 301.63 million members. The company reported record operating income exceeding $10 billion for fiscal 2024 and projects 2025 revenue between $43.5 billion and $44.5 billion."
2025-01-22,NFLX,"B of A Securities Maintains Buy on Netflix, Raises Price Target to $1175"
2025-01-22,NFLX,"Deutsche Bank Maintains Hold on Netflix, Raises Price Target to $875"
2025-01-22,NFLX,"Netflix shares surged over 14% in premarket trading following strong Q4 results, including 20 million new subscribers and a price hike. The broader market is reacting to President Trump's announcement of a $500 billion AI project involving Oracle, OpenAI, and SoftBank."
2025-01-22,NFLX,"Netflix announced a 16% price increase for its streaming plans, raising the ad-free standard plan to $17.99, the premium tier to $24.99, and the ad-supported option to $7.99. This follows a Q4 report showing $10.25 billion in revenue and 18.91 million new subscribers. Shares surged 14.39% to $994.89."
2025-01-22,NFLX,"Netflix reported Q4 revenue of $10.25 billion (up 16% YoY) and EPS of $4.27, both beating estimates. The company added 18.91 million subscribers, reaching 301.63 million total. Netflix repurchased $6.2 billion in shares in 2024 and approved an incremental $15 billion buyback. Q1 2025 revenue guidance is $10.42 billion, with full-year 2025 revenue projected at $43.5 billion to $44.5 billion. Netflix will stop reporting membership growth metrics in 2025."
2025-01-22,NFLX,"Netflix reported Q4 financial results with 18.91 million paid subscriber additions, a 15.9% year-over-year increase. The company projects full-year 2025 revenue between $43.5 billion and $44.5 billion, an increase of $0.5 billion from previous guidance. Shares rose 14.4% to $994.80 in after-hours trading."
2025-01-22,NFLX,"Netflix shares rose 15% to $1,000 following Q4 earnings that exceeded expectations in revenue ($9.88 billion), profit, and subscriber growth. Goldman Sachs raised its price target from $850 to $960 but maintained a Neutral rating, citing valuation concerns. The ad-supported tier grew 30% quarter-over-quarter. Netflix repurchased $1 billion in shares and authorized $15 billion more. The company projects Q1 2025 revenue of $10.42 billion and full-year 2025 free cash flow of $8 billion."
2025-01-22,NFLX,"Netflix shares rose 14.6% to $996.60 in premarket trading after reporting 18.91 million new paid subscribers in Q4, a 15.9% year-over-year increase. The company updated its full-year 2025 revenue guidance to a range of $43.5 billion to $44.5 billion, an increase of $0.5 billion from previous estimates."
2025-01-22,NFLX,"Canaccord Genuity Upgrades Netflix to Buy, Raises Price Target to $1150"
2025-01-22,NFLX,"Barclays Upgrades Netflix to Equal-Weight, Raises Price Target to $900"
2025-01-22,NFLX,"Pivotal Research Maintains Buy on Netflix, Raises Price Target to $1250"
2025-01-22,NFLX,"Evercore ISI Group Maintains Outperform on Netflix, Raises Price Target to $1100"
2025-01-22,NFLX,"Rosenblatt Upgrades Netflix to Buy, Raises Price Target to $1494"
2025-01-22,NFLX,"Oppenheimer Maintains Outperform on Netflix, Raises Price Target to $1150"
2025-01-22,NFLX,"Roku shares rose after Netflix reported Q4 revenue of $10.25 billion and EPS of $4.27, both beating analyst estimates. Netflix added 18.91 million paid subscribers, reaching a total of 301.63 million. The company's ad-supported plan accounted for over 55% of sign-ups in the quarter and grew nearly 30% quarter-over-quarter."
2025-01-22,NFLX,Netflix Says Board Has Approved An Incremental $15B For Repurchase Program Which Brings Total Buyback Authorization To $17.1B
2025-01-22,NFLX,Netflix Raises FY25 Revenue Guidance By $500M To $43.5B-$44.5B; Sees Operating Margin At 29%
2025-01-22,NFLX,"Netflix Sees Q1 EPS $5.58 vs $5.98 Est., Revenue $10.416B vs $10.489B Est."
2025-01-22,NFLX,"Netflix Q4 Global Streaming Paid Memberships 301.63M, Up 15.9% YoY"
2025-01-22,NFLX,"On the second day of Donald Trump's presidency, the Russell 2000 rallied 1.7% while the Dow Jones rose 1.2% and the S&P 500 and Nasdaq 100 each gained 0.9%. Netflix was scheduled to report earnings after the market close on Tuesday."
2025-01-22,NFLX,"In December, Netflix tied its platform record with an 8.5% market share, up 14% from November, driven by NFL Christmas games and the second season of 'Squid Game'. Streaming overall reached a 43.3% market share. Netflix is scheduled to report Q4 earnings on Jan. 21, with analysts expecting $4.19 EPS and $10.11 billion in revenue."
2025-01-22,NFLX,"Netflix Q4 2024 EPS $4.27 Beats $4.19 Estimate, Sales $10.247B Beat $10.114B Estimate"
2025-01-22,NFLX,"Guggenheim Maintains Buy on Netflix, Raises Price Target to $1100"
2025-01-22,NFLX,"Keybanc Maintains Overweight on Netflix, Raises Price Target to $1100"
2025-01-22,NFLX,"Loop Capital Maintains Hold on Netflix, Raises Price Target to $1000"
2025-01-22,NFLX,"The U.S. stock market is rising, supported by strong earnings from Netflix (NFLX), United Airlines (UAL), Interactive Brokers (IBKR), and Procter & Gamble (PG). Market sentiment is currently extremely positive, fueled by the announcement of 'Stargate,' a $500B AI data center venture involving OpenAI, SoftBank, Oracle, and MGX, with Microsoft, NVIDIA, and Arm as partners."
2025-01-22,NFLX,"Benzinga Market Summary: AI Stocks Rise On Stargate AI Investment, Netflix Rises On Strong Earnings And Price Hike, 10-Year Treasury Yield Rises"
2025-01-22,NFLX,"Netflix (NFLX) shares rose 13.7% to $989.14 on Wednesday following the company's report of stronger-than-expected fourth-quarter financial results on Tuesday. The stock was among several big movers, including Seagate Technology, which gained 8.4% after beating EPS and revenue estimates."
2025-01-22,NFLX,"Netflix (NFLX) reported Q4 revenue of $10.25 billion, up 16% year-over-year, beating the $10.11 billion consensus estimate. Earnings per share were $4.27, exceeding the $4.19 estimate. The company added 18.91 million paid subscribers, a 15.9% increase year-over-year. Following these results, U.S. stocks traded higher on Wednesday."
2025-01-23,NFLX,"The S&P 500 reached a new all-time high on Wednesday, while the CNN Money Fear and Greed index remained in the 'Fear' zone at 43.3. Netflix reported stronger-than-expected fourth-quarter results, and Procter & Gamble posted better-than-expected second-quarter results. Abbott Laboratories missed revenue consensus for the fourth quarter."
2025-01-23,NFLX,"Netflix reported Q4 revenue of $10.25 billion and EPS of $4.27, beating estimates of $10.11 billion and $4.19. The company added 18.9 million subscribers, exceeding the 9.2 million estimate, driven by live sports like the Mike Tyson-Jake Paul fight and 'Squid Game 2'. A 14% price hike saw minimal attrition. Q1 2025 guidance missed expectations with $10.42 billion revenue and $5.58 EPS. Analysts raised price targets, including Macquarie to $1,150 and KeyBanc to $1,100."
2025-01-23,NFLX,'Netflix to Open Restaurant in Las Vegas Next Month As Live Experiences Business Expands' - Hollywood Reporter
2025-01-23,NFLX,"Piper Sandler Reiterates Overweight on Netflix, Raises Price Target to $1100"
2025-01-23,NFLX,"U.S. stock futures were mixed on Thursday following a Wednesday rally where the S&P 500 reached a new intraday all-time high. Netflix and Procter & Gamble reported better-than-expected financial results, which boosted market sentiment. The 10-year Treasury note yielded 4.63%, and there is a 99.5% probability the Federal Reserve will hold interest rates steady on Jan. 31, 2025."
2025-01-23,NFLX,"UBS Maintains Buy on Netflix, Raises Price Target to $1150"
2025-01-23,NFLX,"Netflix Inc. (NFLX) hit all-time highs on Wednesday, with shares up 10% to $959.38, following a Q4 report that included 18.9 million net new paid subscribers and a total of 301.6 million global subscribers. Netflix's market capitalization of $410 billion now exceeds the combined value of the four major U.S. broadcast network owners (Disney, Comcast, Fox, Paramount) and several streaming competitors. The company cited strong content, including NFL games, 'Squid Game,' and the Jake Paul vs. Mike Tyson match, as drivers for growth. Netflix held an 8.5% market share in December according to Nielsen."
2025-01-23,NFLX,"The S&P 500 reached a record high of 6,100.4 points on Wednesday, driven by strong Q4 earnings and the announcement of the $500 billion 'AI Stargate' initiative. As of Jan. 17, 81% of S&P 500 companies beat profit forecasts. Netflix Inc. (NFLX) was among the top contributors to the index's gain, rising 9.54% to $952.64. Other notable performers included Nvidia (up 4.55%) and Microsoft (up 3.94%)."
2025-01-23,NFLX,"Tech stocks surged Wednesday following the unveiling of the $500 billion 'Stargate Project' by Donald Trump, Sam Altman, Larry Ellison, and Masayoshi Son. Netflix Inc. (NFLX) shares rose 12% following a strong quarterly performance. Major indices saw gains, with the Nasdaq 100 up 1.7% and the S&P 500 up 0.9%. Conversely, Bitcoin fell nearly 2% to $104,000, and Chinese stocks slipped 0.8% amid potential tariff news."
