date,symbols,summary
2026-01-21,NFLX,"Netflix shares fell 3.3% to $84.34 following Q4 results where the company reported $12.05 billion in revenue and 56 cents EPS. Multiple analysts lowered their price targets, including Pivotal Research ($95), Goldman Sachs ($100), Needham ($120), Rosenblatt ($94), Guggenheim ($130), Morgan Stanley ($110), BMO Capital ($135), Canaccord Genuity ($125), Keybanc ($108), and UBS ($130)."
2026-01-21,NFLX,"Netflix Co-CEO Greg Peters dismissed concerns regarding slowing total view hours, stating the metric is oversimplified and influenced by geography and plan mix. Instead, the company focuses on retention and customer satisfaction as key indicators of health. Netflix maintains that its long-term organic growth strategy does not rely on M&A, such as a potential Warner Bros.-HBO acquisition."
2026-01-21,NFLX,"Netflix shares fell approximately 3% on Wednesday following Q4 financial results. The company reported EPS of 56 cents and revenue of $12.05 billion, both beating consensus estimates. For Q1, Netflix guided for 76 cents EPS and $12.16 billion in revenue, with plans to invest in content, advertising, live events, video podcasts, and games."
2026-01-21,NFLX,"UBS Maintains Buy on Netflix, Lowers Price Target to $130"
2026-01-21,NFLX,Keybanc analyst Justin Patterson maintained an Overweight rating on Netflix while lowering the price target from $110 to $108. Netflix shares closed at $87.05 on Tuesday.
2026-01-21,NFLX,"Netflix shares dropped 6.82% to $81.14 following Q4 earnings and Q1 guidance below estimates. Q4 revenue rose 18% year-over-year to $12.05 billion with 56 cents EPS. Multiple firms cut price targets, including Pivotal Research ($95), Goldman Sachs ($100), Needham ($120), Rosenblatt ($94), and Guggenheim ($130). Technical indicators show the stock is in oversold territory with an RSI of 25.74."
2026-01-21,NFLX,"Wedbush Reiterates Outperform on Netflix, Maintains $115 Price Target"
2026-01-21,NFLX,"Wall Street tumbled on Tuesday due to risk-off sentiment following President Trump's aggressive trade stance toward Europe, including tariff threats. Major indices like the S&P 500 fell 1.5%. Treasury yields rose, with the 30-year yield up 6 basis points to 4.90%. Gold and silver prices surged, while Bitcoin dropped below $90,000. Netflix (NASDAQ: NFLX) is among the companies scheduled to report earnings after the market close."
2026-01-21,NFLX,"Netflix (NASDAQ: NFLX) shares fell 5.48% despite reporting better-than-expected fourth-quarter results. The company provided first-quarter revenue guidance of $12.16 billion, below the $12.19 billion consensus estimate, and projected earnings per share of 76 cents, missing the 81-cent estimate. Benzinga's Edge Stock Rankings note a weak price trend across all timeframes but a strong quality ranking."
2026-01-21,NFLX,"Keybanc Maintains Overweight on Netflix, Lowers Price Target to $108"
2026-01-21,NFLX,"Canaccord Genuity Maintains Buy on Netflix, Lowers Price Target to $125"
2026-01-21,NFLX,"BMO Capital Maintains Outperform on Netflix, Lowers Price Target to $135"
2026-01-21,NFLX,"Morgan Stanley Maintains Overweight on Netflix, Lowers Price Target to $110"
2026-01-21,NFLX,"Netflix (NASDAQ: NFLX) shares dropped 5.7% to $82.32 in pre-market trading following the release of fourth-quarter financial results. While the quarterly results beat expectations, the company issued first-quarter guidance below Street consensus, projecting $12.16 billion in revenue versus the $12.19 billion estimate and 76 cents in earnings per share compared to the 81-cent estimate."
2026-01-21,NFLX,"Guggenheim Maintains Buy on Netflix, Lowers Price Target to $130"
2026-01-21,NFLX,"Rosenblatt Maintains Neutral on Netflix, Lowers Price Target to $94"
2026-01-21,NFLX,"Pivotal Research Maintains Hold on Netflix, Lowers Price Target to $95"
2026-01-21,NFLX,"Netflix (NASDAQ: NFLX) shares dipped 5.7% to $82.32 in pre-market trading. The company reported better-than-expected fourth-quarter results but provided first-quarter guidance below Street consensus, with projected revenue of $12.16 billion against a $12.19 billion estimate and earnings per share of 76 cents versus an 81-cent estimate."
2026-01-21,NFLX,"Netflix (NASDAQ: NFLX) shares fell 6.84% to $81.30 during Wednesday's pre-market session, with a market value of $370.1 billion. The decline follows the company's fourth-quarter earnings report released the previous day."
2026-01-21,NFLX,"Netflix (NASDAQ: NFLX) reported better-than-expected fourth-quarter financial results. However, the company issued first-quarter guidance below Street consensus, forecasting $12.16 billion in revenue (vs. $12.19 billion estimate) and 76 cents in earnings per share (vs. 81 cents estimate). Shares declined 4.8% to $82.84 in after-hours trading."
2026-01-21,NFLX,"In Tuesday's after-market session, Netflix (NFLX) shares declined 2.72% to $84.89 following the release of its Q4 earnings report. The company's market capitalization is $373.2 billion."
2026-01-21,NFLX,Netflix Sees Q1 GAAP EPS $0.76 vs $0.81 Est; Sees Sales $12.157B vs $12.188B Est
2026-01-21,NFLX,Netflix Sees FY2026 Sales $50.700B-$51.700B vs $45.081B Est
2026-01-21,NFLX,Netflix Crossed 325M Paid Memberships During Q4; Expects Higher Operating Income Growth In H2 2026 Than In H1; Outlook 2026 Ad Rev To Roughly Double; Operating Margin Of 31.5%
2026-01-21,NFLX,"Netflix Says In 2026, We'll Also Expand Our Offering Of Licensed Titles. Starting This Month, Members Will Be Able To Enjoy New Release Live Action Films From Our New U.S. Licensing Partnership With Universal"
2026-01-21,NFLX,Netflix Says Addition Of HBO Max Will Allow Us To Offer More Personalized And Flexible Subscription Options
2026-01-21,NFLX,"Netflix reported Q4 revenue of $12.05 billion (up 17.6% YoY) and EPS of 56 cents, both beating consensus estimates. The company surpassed 325 million paid subscribers. For 2026, Netflix projects revenue between $50.70 billion and $51.70 billion. The company amended its acquisition offer for Warner Bros. Discovery to an all-cash transaction valued at $27.75 per share. Following the report, Netflix stock fell 4.8% to $82.88 in after-hours trading."
2026-01-21,NFLX,"Netflix Q4 EPS $0.56 Beats $0.55 Estimate, Sales $12.050B Beat $11.969B Estimate"
2026-01-21,NFLX,'Banks Selling $8.2 Billion More Netflix Debt for Warner Bros Bid' - Bloomberg News
2026-01-21,NFLX,"Netflix shares fell 1.08% to close at $87.05, with an intraday range of $87.02 to $89.90 and a 52-week range of $82.11 to $134.12. In after-hours trading, the stock dropped 4.84% to $82.84. Netflix announced an all-cash offer of $27.75 per share to acquire Warner Bros. Discovery's studio and streaming businesses for $82.7 billion, gaining unanimous board approval. The deal includes film/TV studios, content libraries, and HBO Max. Benzinga Edge Stock Rankings place Netflix in the 8th percentile for momentum and 14th for value, noting it is faltering on short, medium, and long price trends."
2026-01-21,NFLX,"Netflix Says ""We First Prioritize Reinvestment In The Business, Both Organically And Through Selective M&A, While Maintaining Liquidity And Then Returning Excess Cash To Shareholders Through Share Repurchases. Consistent With That Framework, We'll Pause Our Share Buybacks To Accumulate Cash To Help Fund The Pending Acquisition Of Warner Bros"""
2026-01-21,NFLX,"Netflix (NASDAQ: NFLX) has switched to an all-cash offer of $27.75 per share to acquire Warner Bros. Discovery, replacing a previous offer of $23.25 in cash plus $4.50 in stock. The acquisition would include Warner Bros.' studios, content library, and HBO Max. Prediction market data from Kalshi indicates a 70% probability of a successful Netflix acquisition, while Paramount Skydance has filed a lawsuit regarding the deal."
2026-01-21,NFLX,"Needham Maintains Buy on Netflix, Lowers Price Target to $120"
2026-01-22,NFLX,Netflix shares fell approximately 2% on Wednesday following the company's fourth-quarter financial results and first-quarter guidance that missed market estimates.
2026-01-22,NFLX,"Paramount Urges WBD Shareholders To Reject Netflix Deal, Calls It Inferior To Its $30 All-Cash Offer"
2026-01-22,NFLX,"Argus Research Maintains Buy on Netflix, Lowers Price Target to $110"
2026-01-22,NFLX,"Netflix, with over 300 million global subscribers, is evaluated against entertainment industry peers. Financial metrics include a P/E ratio of 33.74, P/B of 13.60, P/S of 8.21, and ROE of 9.2%. The company reported $7.37 billion in EBITDA, $5.35 billion in gross profit, and 4.7% revenue growth. Netflix maintains a debt-to-equity ratio of 0.54, which is lower than its top four peers. The analysis suggests Netflix is potentially undervalued based on its P/E ratio while showing robust financial performance and efficient operations."
2026-01-22,NFLX,"On Wednesday, Jan. 21, 2026, Cathie Wood's Ark Invest (ARKW fund) purchased 83,368 shares of Netflix for approximately $7.11 million. The trade occurred after Netflix reported fourth-quarter earnings of 56 cents per share, beating expectations, but provided first-quarter guidance that fell short of estimates. Netflix shares closed at $85.36, down 2.18%."
2026-01-22,NFLX,"YouTube is expanding its creator economy and AI tools to compete with Netflix. Netflix reported Q4 revenue of $12.05 billion, up 17.6% year-over-year, with over 325 million paid subscribers. Netflix provided Q1 2026 guidance of $12.16 billion in revenue and 76 cents earnings per share, with full-year 2026 revenue forecasted between $50.7 billion and $51.7 billion."
2026-01-22,NFLX,'Warner Bros. Suitors Face Rare Head-to-Head Battle for EU Nod' - Bloomberg News
2026-01-22,NFLX,"During its Q4 earnings call, Netflix (NASDAQ: NFLX) highlighted its transition into a multi-dimensional entertainment hub. Co-CEO Ted Sarandos discussed the pending Warner Bros. Discovery (WBD) acquisition as a strategic accelerant. The company is expanding live events, video podcasts, and cloud gaming. CFO Spencer Neumann projected 2026 revenue at $51 billion, a 14% year-over-year increase, with ad revenue expected to double to $3 billion. Netflix stock was down 3.13% at $84.53 on Wednesday."
2026-01-22,NFLX,"Netflix (NASDAQ: NFLX) shares fell more than 4% on Wednesday despite beating quarterly estimates, as the company's first-quarter 2026 guidance disappointed investors."
2026-01-22,NFLX,"Netflix (NASDAQ: NFLX) shares hit 52-week lows of $81.93 on Wednesday following Q4 results. While the company beat revenue and EPS estimates, analysts lowered price targets due to guidance and acquisition concerns regarding Warner Bros. Discovery. Goldman Sachs cut its target to $100 (Neutral), Rosenblatt to $94 (Neutral), Canaccord Genuity to $125 (Buy), and KeyBanc to $108 (Overweight). Wedbush maintained an Outperform rating with a $115 target. Full-year 2025 ad revenue reached $1.5 billion, with expectations to double in 2026."
2026-01-22,NFLX,"Wolfe Research Maintains Outperform on Netflix, Lowers Price Target to $95"
2026-01-22,NFLX,"Oppenheimer Maintains Outperform on Netflix, Lowers Price Target to $125"
2026-01-22,NFLX,"TD Cowen Maintains Buy on Netflix, Lowers Price Target to $112"
2026-01-22,NFLX,"Deutsche Bank Maintains Hold on Netflix, Raises Price Target to $98"
2026-01-22,NFLX,"Piper Sandler Reiterates Overweight on Netflix, Lowers Price Target to $103"
2026-01-22,NFLX,"Live On CNBC, Steve Weiss Announces Sold Half Of His Netflix Position"
2026-01-22,NFLX,"Netflix options activity shows 121 unusual trades, with 47% bullish and 38% bearish sentiment. Total call value is $5,101,172 and put value is $5,093,556. Analysts maintain an average price target of $115.2, with ratings from Guggenheim, Rosenblatt, TD Cowen, Canaccord Genuity, and Wedbush. The stock is currently trading at $83.2, down 4.65%, with earnings expected in 85 days."
2026-01-23,NFLX,"Netflix is facing potential revenue loss due to boycotts in Denmark and other European countries, triggered by U.S. tariff threats and disputes over Greenland. Residents are using apps like NonUSA and Made O'Meter to identify and avoid American products. In the fourth quarter, Netflix's EMEA region revenue was $3.87 billion, up 18% year-over-year. Some Danish residents have reportedly canceled subscriptions in favor of local media options."
2026-01-23,NFLX,'Netflix's Sarandos to Testify in Senate Hearing on Warner Deal' - Bloomberg
2026-01-23,NFLX,"Netflix (NASDAQ: NFLX) maintains a global subscriber base of over 300 million. Financial metrics show a P/E ratio of 33.02, P/B of 13.31, and P/S of 8.03. The company reports an ROE of 9.2%, EBITDA of $7.37 billion, and revenue growth of 4.7%. With a debt-to-equity ratio of 0.54, Netflix demonstrates stronger financial positioning and profitability compared to its primary entertainment industry peers."
2026-01-23,NFLX,Netflix co-CEO Greg Peters criticized Paramount Skydance's $108 billion bid for Warner Bros. Discovery as unrealistic and overly leveraged without Larry Ellison's backing. Netflix has proposed an $82.7 billion all-cash offer. Peters stated Netflix would maintain Warner Bros.' 45-day theatrical window. Netflix shares fell 2.13% on Thursday and are down 10.65% over the past month.
2026-01-23,NFLX,'Netflix Says Paramount Bid 'Doesn't Pass Sniff Test' As Warner Battle Intensifies' - FT
2026-01-24,NFLX,"Netflix, Inc. (NASDAQ: NFLX) shares fell to 52-week lows between $81 and $83 following disappointing fourth-quarter earnings and guidance. Despite beating top and bottom-line metrics, Wall Street firms lowered price targets due to concerns over a soft Q1 outlook, content spending, and strategic initiatives, though some analysts suggest the stock may be forming a floor."
2026-01-24,NFLX,"Netflix (NASDAQ: NFLX) shares are trading higher on Friday after trending lower since early July. The stock has reached a support level around $83, a point where sell-offs previously ended in January and April. Analysts suggest there is a potential for a reversal and upward trend as buyers increase their bids at this support level."
2026-01-24,NFLX,'FCC Chief Sees 'Competition Concerns' in Netflix-Warner Deal' - Bloomberg
2026-01-24,NFLX,"Netflix (NASDAQ: NFLX) is pursuing an $82.7 billion all-cash acquisition of Warner Bros. Discovery (NASDAQ: WBD) at $27.75 per share. Co-CEO Greg Peters identified YouTube as the primary competitive threat due to its high viewership hours. Peters cited theatrical distribution, production infrastructure, and the HBO brand as key value drivers, arguing the deal is vertical and complementary."
2026-01-24,NFLX,"Netflix (NASDAQ: NFLX) has proposed an $82.7 billion all-cash deal for Warner Bros. Discovery (NASDAQ: WBD) assets, marking a departure from its 'build-not-buy' strategy. Co-CEO Greg Peters identified Alphabet's YouTube as the company's most formidable competitor."
2026-01-25,NFLX,"Senator Elizabeth Warren criticized President Donald Trump for purchasing over $1 million in investments tied to Netflix, Inc. (NASDAQ: NFLX) and Warner Bros. Discovery shortly after the companies announced a major deal, raising concerns regarding presidential influence on consumer tech mergers."
2026-01-25,NFLX,"Netflix, Inc. (NASDAQ: NFLX) received 16 nominations for the 98th Academy Awards across major categories, aiming for a comeback after leading with the same number of nominations last year."
2026-01-26,NFLX,Inquiry Into Netflix's Competitor Dynamics In Entertainment Industry
2026-01-27,NFLX,"Netflix (NASDAQ: NFLX) is a streaming service with over 300 million global subscribers. It introduced ad-supported plans in 2022. Financial metrics include a P/E of 33.87, P/B of 13.6, P/S of 8.24, and ROE of 9.2%. The company reported $7.85 billion in EBITDA, $5.53 billion in gross profit, and 17.61% revenue growth. Its debt-to-equity ratio is 0.54, which is lower than its top 4 peers, indicating a strong financial position. While the P/E ratio suggests potential undervaluation, high P/B and P/S ratios may indicate overvaluation relative to industry standards."
2026-01-27,NFLX,'UK Politicians Call For Competition Review Of Netflix Bid For Warner Bros' - FT
2026-01-27,NFLX,"TikTok avoided a U.S. ban by creating a new entity, TikTok USDS Joint Venture LLC, where American and global investors own 80.1% and ByteDance retains 19.9%. Oracle, Silver Lake, and MGX will each hold 15% and serve as managing investors. User data and the recommendation algorithm will be hosted on Oracle's U.S. cloud infrastructure. Sen. Bernie Sanders criticized the deal, arguing it concentrates power in billionaire Larry Ellison, who also has influence over Paramount Skydance (NASDAQ: PSKY) and its media assets, including CBS, MTV, and Paramount+. Paramount Skydance is currently in a competition with Netflix (NASDAQ: NFLX) regarding Warner Bros. Discovery (NASDAQ: WBD)."
2026-01-28,NFLX,"Options activity for Netflix, Inc. (NASDAQ: NFLX) showed a bullish call option trade expiring on March 20, 2026. The trade involved 3 contracts at a $1,120.00 strike price, with a total trade price of $36.0K and a contract price of $12,015.0."
2026-01-28,NFLX,"Netflix (NASDAQ: NFLX) maintains a streaming-focused business model with over 300 million global subscribers and ad-supported plans introduced in 2022. Financial analysis shows a P/E of 33.83, P/B of 13.58, P/S of 8.23, and ROE of 9.2%. The company reported $7.85 billion in EBITDA, $5.53 billion in gross profit, and 17.61% revenue growth, outperforming the industry average of 1.07%. With a debt-to-equity ratio of 0.54, Netflix demonstrates a stronger financial position than its top 4 peers. The company's low P/E ratio suggests potential undervaluation, while high P/B and P/S ratios reflect strong market sentiment."
2026-01-29,NFLX,"Netflix (NASDAQ: NFLX) options activity shows 85 unusual trades, with 36% bullish and 43% bearish sentiment. There were 23 puts valued at $2,228,587 and 62 calls valued at $3,740,633. The stock is trading at $85.31, down -0.32%, with RSI indicators suggesting it may be oversold. Five analysts maintain an average target price of $113.8, with Buy/Overweight ratings from Needham ($120), Freedom Capital Markets ($104), Canaccord Genuity ($125), Argus Research ($110), and Morgan Stanley ($110). Next earnings are expected in 78 days."
2026-01-29,NFLX,"Netflix, with over 300 million global subscribers, operates a streaming-only model and introduced ad-supported plans in 2022. Financial analysis shows a P/E of 33.45, P/B of 13.43, and P/S of 8.14. The company outperforms industry averages in ROE (9.2%), EBITDA ($7.85 billion), gross profit ($5.53 billion), and revenue growth (17.61%). With a debt-to-equity ratio of 0.54, Netflix maintains a stronger financial position than its top four peers."
2026-01-30,NFLX,"Netflix maintains a streaming-focused business model with over 300 million global subscribers and ad-supported tiers launched in 2022. Key metrics include a P/E of 32.87, P/B of 13.19, and P/S of 7.99. The company exhibits strong financial performance compared to industry averages, with a 9.2% ROE, $7.85 billion in EBITDA, $5.53 billion in gross profit, and 17.61% revenue growth. Its debt-to-equity ratio of 0.54 indicates a favorable financial position relative to its top four peers."
2026-02-01,NFLX,"YouTube is aggressively removing AI-generated spam content to protect its advertising and streaming business, with CEO Neal Mohan prioritizing this reduction for 2026. Alphabet-owned YouTube competes with Netflix in the digital entertainment space, reporting over $100 billion paid to creators over four years and 200 billion daily views for Shorts."
2026-02-02,NFLX,"Netflix stock hit a 52-week low despite beating earnings estimates, trading down from the $109 range to the low $80s. Investors are concerned about the potential all-cash acquisition of Warner Bros. Discovery, which has led to the cessation of share repurchases and fears of increased debt. Melissa Otto of S&P Global suggested the stock may remain 'dead money' without a catalyst. Additionally, Netflix projects content spending to reach $20 billion this year with shrinking profit margins."
2026-02-02,NFLX,CNBC Reports Warner Bros. Discovery Shareholder Vote On Netflix Deal Likely To Be  Held In March
2026-02-03,NFLX,"Federal regulators approved Disney's billion-dollar acquisition of NFL Media assets, including NFL Network and RedZone. Senator Elizabeth Warren criticized the deal, citing risks of higher costs and fewer choices for consumers. The deal increases ESPN's regular-season game count to 28 per year. The NFL remains in $110 billion worth of media contracts, with competition intensifying from Amazon Prime Video, Netflix, and YouTube."
2026-02-03,NFLX,"Tuttle Capital Management CEO Matthew Tuttle warned that Europe is developing a 'kill switch' for U.S. tech, citing procurement shifts away from American firms like Microsoft, Zoom, Cisco, and Alphabet. The European Commission's Digital Networks Act and other regulatory pressures are impacting U.S. tech giants, including Netflix, which were reported to avoid binding new obligations. Tensions are further strained by U.S.-EU tariff threats and trade disagreements."
2026-02-03,NFLX,"Live On CNBC, Terranova ETF (JOET) Sold Walt Disney Company; Sold Netflix"
2026-02-03,NFLX,"Netflix Inc.'s short interest as a percent of float decreased by 8.0%, with 67.75 million shares sold short, representing 1.61% of available shares. It takes approximately 2.02 days to cover these positions. Netflix's short interest is lower than its peer group average of 9.25%."
2026-02-03,NFLX,"Charles Gasparino Posts On X ""BREAKING: People inside @wbd  tell me The Ellison's and @paramountco have approximately two weeks to put up a sweetened bid for the company given the @SECGov 's light review of their proxy or shareholder vote to approve the @netflix  deal, which they refiled today. As the nypost
 previously reported, $WBD is aiming for a March vote on the deal..."""
2026-02-04,NFLX,"'Netflix, Warner Bros. Set to Defend Deal Before Skeptical Panel' - Bloomberg"
2026-02-04,NFLX,"Representative Cleo Fields filed a purchase of Alphabet stock on February 3, 2026, valued between $252,006 and $580,000, executed on January 20, 2026. Recent disclosures also show Fields purchased Netflix stock in two separate transactions, each valued between $100,001 and $250,000."
2026-02-04,NFLX,"Netflix co-CEO Ted Sarandos testified before the U.S. Senate Judiciary Committee, defending the company's $82.7 billion all-cash acquisition of Warner Bros. Discovery. Sarandos argued that YouTube is the dominant TV platform, accounting for significant viewing time. Netflix currently holds about 9% of U.S. TV viewing time, projected to reach 10% post-merger. Ross Gerber expressed support for the testimony."
2026-02-05,NFLX,"Software stock valuations have contracted significantly, with forward 12-month P/E ratios dropping from 33.1x to 23.2x, levels reminiscent of Covid-era lows. Five tech giants are experiencing rare drawdowns: Salesforce (-44%), Oracle (-56%), Netflix (-40%), Adobe (-27%), and Microsoft (-26%). Despite market panic, analysts suggest fundamentals remain strong, with Netflix benefiting from its ad and gaming businesses."
2026-02-05,NFLX,"Netflix shares rose after President Trump stated he would not intervene in the $82.7 billion merger with Warner Bros. Discovery. The deal faces competition from a $108.7 billion hostile bid by Paramount Skydance. Netflix is currently trading at a premium P/E of 31.7x, with an April 16 earnings report expected to show EPS of 76 cents and revenue of $12.17 billion. Analysts maintain a Buy rating with an average price target of $119.15."
2026-02-05,NFLX,"President Donald Trump announced he will not intervene in the $82.7 billion merger between Netflix and Warner Bros. Discovery, deferring to the DOJ. WBD's board recommended Netflix's $27.75 per share all-cash offer, while Paramount Skydance has made a $108.7 billion hostile bid. Netflix co-CEO Ted Sarandos recently faced a Senate Judiciary subcommittee hearing regarding potential monopoly concerns. If the deal fails, Netflix faces a $5.8 billion breakup fee, while a pivot to Paramount would cost WBD $2.8 billion. Year-to-date, Netflix shares have declined 11.90%."
2026-02-05,NFLX,"Verizon filed a federal lawsuit against T-Mobile, alleging false advertising regarding claims that customers can save over $1,000 annually. Verizon claims these assertions were previously flagged as misleading by the National Advertising Review Board in 2025 and 2026. The dispute involves bundled services, including Netflix, HBO Max, Disney+, and ESPN+. Verizon reported Q4 revenue of $36.40 billion and added 616,000 postpaid phone subscribers."
2026-02-06,NFLX,"Netflix has outperformed the market over the last 10 years with an average annual return of 24.77%, which is 10.92% higher than the market on an annualized basis. A $100 investment in Netflix 10 years ago would be worth $938.93 today, based on a current price of $80.46."
2026-02-06,NFLX,"Representative Cleo Fields disclosed his first stock purchases of 2026, including Netflix shares bought on January 20, 2026, valued between $50,000 and $100,000. Fields has invested over $1 million in Netflix over the past year. Other January 2026 purchases included TSM, Alphabet, IREN, and Meta Platforms."
2026-02-07,NFLX,"The U.S. Justice Department is investigating Netflix's proposed $82.7 billion acquisition of Warner Bros. Discovery assets for potential anticompetitive conduct, issuing a civil subpoena to an entertainment company. Netflix agreed to the deal at $27.75 per share, while Paramount Skydance has made a rival $77.9 billion hostile bid. Netflix argues that the combined entity would not create a monopoly, noting that 80% of HBO Max subscribers already use Netflix. Netflix shares closed at $82.20 on Friday."
